Sheet: Sheet1
A1: Monster HP | B1: 25600 | E1: Iteration | F1: Raw Damage | G1: Total Blast Buildup | I1: AFTER | J1: a term | K1: b term | L1: c term | M1: ArithProg n | N1: Num Procs | P1: MANUAL | Q1: Num Procs | R1: ArithProg n | S1: Curr Thres | T1: Sum Thres | U1: Under Thres | V1: Blast Damage | W1: Total Damage | X1: Monster Dead
E2: 0 | F2: of:=[.E2]*[.$B$3] -> 0 | G2: of:=[.E2]*[.$B$4] -> 0 | J2: of:=[.$B$7] -> 20 | K2: of:=(2*[.$B$6])-[.$B$7] -> 60 | L2: of:=-2*[.T2] -> -80 | M2: of:=((-[.K2])+SQRT(([.K2]^2) - (4*[.J2]*[.L2])))/(2*[.J2]) -> 1 | N2: of:=[.M2]-1 -> 0 | Q2: 0 | R2: of:=[.Q2]+1 -> 1 | S2: of:=[.$B$6] + (([.R2]-1) * [.$B$7]) -> 40 | T2: of:=([.R2]/2)*([.$B$6]+[.S2]) -> 40 | U2: of:=[.T2]>=[.G2] -> true | V2: of:=[.Q2]*[.$B$9] -> 0 | W2: of:=[.F2]+[.V2] -> 0 | X2: of:=[.W2]>=[.$B$1] -> false
A3: Raw Damage | B3: 250 | E3: 1 | F3: of:=[.E3]*[.$B$3] -> 250 | G3: of:=[.E3]*[.$B$4] -> 11.33 | J3: of:=[.$B$7] -> 20 | K3: of:=(2*[.$B$6])-[.$B$7] -> 60 | L3: of:=-2*[.T3] -> -80 | M3: of:=((-[.K3])+SQRT(([.K3]^2) - (4*[.J3]*[.L3])))/(2*[.J3]) -> 1 | N3: of:=[.M3]-1 -> 0 | Q3: 0 | R3: of:=[.Q3]+1 -> 1 | S3: of:=[.$B$6] + (([.R3]-1) * [.$B$7]) -> 40 | T3: of:=([.R3]/2)*([.$B$6]+[.S3]) -> 40 | U3: of:=[.T3]>=[.G3] -> true | V3: of:=[.Q3]*[.$B$9] -> 0 | W3: of:=[.F3]+[.V3] -> 250 | X3: of:=[.W3]>=[.$B$1] -> false
A4: EFS | B4: 11.33 | E4: 2 | F4: of:=[.E4]*[.$B$3] -> 500 | G4: of:=[.E4]*[.$B$4] -> 22.66 | J4: of:=[.$B$7] -> 20 | K4: of:=(2*[.$B$6])-[.$B$7] -> 60 | L4: of:=-2*[.T4] -> -80 | M4: of:=((-[.K4])+SQRT(([.K4]^2) - (4*[.J4]*[.L4])))/(2*[.J4]) -> 1 | N4: of:=[.M4]-1 -> 0 | Q4: 0 | R4: of:=[.Q4]+1 -> 1 | S4: of:=[.$B$6] + (([.R4]-1) * [.$B$7]) -> 40 | T4: of:=([.R4]/2)*([.$B$6]+[.S4]) -> 40 | U4: of:=[.T4]>=[.G4] -> true | V4: of:=[.Q4]*[.$B$9] -> 0 | W4: of:=[.F4]+[.V4] -> 500 | X4: of:=[.W4]>=[.$B$1] -> false
E5: 3 | F5: of:=[.E5]*[.$B$3] -> 750 | G5: of:=[.E5]*[.$B$4] -> 33.99 | J5: of:=[.$B$7] -> 20 | K5: of:=(2*[.$B$6])-[.$B$7] -> 60 | L5: of:=-2*[.T5] -> -80 | M5: of:=((-[.K5])+SQRT(([.K5]^2) - (4*[.J5]*[.L5])))/(2*[.J5]) -> 1 | N5: of:=[.M5]-1 -> 0 | Q5: 0 | R5: of:=[.Q5]+1 -> 1 | S5: of:=[.$B$6] + (([.R5]-1) * [.$B$7]) -> 40 | T5: of:=([.R5]/2)*([.$B$6]+[.S5]) -> 40 | U5: of:=[.T5]>=[.G5] -> true | V5: of:=[.Q5]*[.$B$9] -> 0 | W5: of:=[.F5]+[.V5] -> 750 | X5: of:=[.W5]>=[.$B$1] -> false
A6: Blast Base | B6: 40 | E6: 4 | F6: of:=[.E6]*[.$B$3] -> 1000 | G6: of:=[.E6]*[.$B$4] -> 45.32 | J6: of:=[.$B$7] -> 20 | K6: of:=(2*[.$B$6])-[.$B$7] -> 60 | L6: of:=-2*[.T6] -> -200 | M6: of:=((-[.K6])+SQRT(([.K6]^2) - (4*[.J6]*[.L6])))/(2*[.J6]) -> 2 | N6: of:=[.M6]-1 -> 1 | Q6: 1 | R6: of:=[.Q6]+1 -> 2 | S6: of:=[.$B$6] + (([.R6]-1) * [.$B$7]) -> 60 | T6: of:=([.R6]/2)*([.$B$6]+[.S6]) -> 100 | U6: of:=[.T6]>=[.G6] -> true | V6: of:=[.Q6]*[.$B$9] -> 100 | W6: of:=[.F6]+[.V6] -> 1100 | X6: of:=[.W6]>=[.$B$1] -> false
A7: Blast ThresInc | B7: 20 | E7: 5 | F7: of:=[.E7]*[.$B$3] -> 1250 | G7: of:=[.E7]*[.$B$4] -> 56.65 | J7: of:=[.$B$7] -> 20 | K7: of:=(2*[.$B$6])-[.$B$7] -> 60 | L7: of:=-2*[.T7] -> -200 | M7: of:=((-[.K7])+SQRT(([.K7]^2) - (4*[.J7]*[.L7])))/(2*[.J7]) -> 2 | N7: of:=[.M7]-1 -> 1 | Q7: 1 | R7: of:=[.Q7]+1 -> 2 | S7: of:=[.$B$6] + (([.R7]-1) * [.$B$7]) -> 60 | T7: of:=([.R7]/2)*([.$B$6]+[.S7]) -> 100 | U7: of:=[.T7]>=[.G7] -> true | V7: of:=[.Q7]*[.$B$9] -> 100 | W7: of:=[.F7]+[.V7] -> 1350 | X7: of:=[.W7]>=[.$B$1] -> false
A8: Blast Cap | B8: 440 | E8: 6 | F8: of:=[.E8]*[.$B$3] -> 1500 | G8: of:=[.E8]*[.$B$4] -> 67.98 | J8: of:=[.$B$7] -> 20 | K8: of:=(2*[.$B$6])-[.$B$7] -> 60 | L8: of:=-2*[.T8] -> -200 | M8: of:=((-[.K8])+SQRT(([.K8]^2) - (4*[.J8]*[.L8])))/(2*[.J8]) -> 2 | N8: of:=[.M8]-1 -> 1 | Q8: 1 | R8: of:=[.Q8]+1 -> 2 | S8: of:=[.$B$6] + (([.R8]-1) * [.$B$7]) -> 60 | T8: of:=([.R8]/2)*([.$B$6]+[.S8]) -> 100 | U8: of:=[.T8]>=[.G8] -> true | V8: of:=[.Q8]*[.$B$9] -> 100 | W8: of:=[.F8]+[.V8] -> 1600 | X8: of:=[.W8]>=[.$B$1] -> false
A9: Blast Damage | B9: 100 | E9: 7 | F9: of:=[.E9]*[.$B$3] -> 1750 | G9: of:=[.E9]*[.$B$4] -> 79.31 | J9: of:=[.$B$7] -> 20 | K9: of:=(2*[.$B$6])-[.$B$7] -> 60 | L9: of:=-2*[.T9] -> -200 | M9: of:=((-[.K9])+SQRT(([.K9]^2) - (4*[.J9]*[.L9])))/(2*[.J9]) -> 2 | N9: of:=[.M9]-1 -> 1 | Q9: 1 | R9: of:=[.Q9]+1 -> 2 | S9: of:=[.$B$6] + (([.R9]-1) * [.$B$7]) -> 60 | T9: of:=([.R9]/2)*([.$B$6]+[.S9]) -> 100 | U9: of:=[.T9]>=[.G9] -> true | V9: of:=[.Q9]*[.$B$9] -> 100 | W9: of:=[.F9]+[.V9] -> 1850 | X9: of:=[.W9]>=[.$B$1] -> false
E10: 8 | F10: of:=[.E10]*[.$B$3] -> 2000 | G10: of:=[.E10]*[.$B$4] -> 90.64 | J10: of:=[.$B$7] -> 20 | K10: of:=(2*[.$B$6])-[.$B$7] -> 60 | L10: of:=-2*[.T10] -> -200 | M10: of:=((-[.K10])+SQRT(([.K10]^2) - (4*[.J10]*[.L10])))/(2*[.J10]) -> 2 | N10: of:=[.M10]-1 -> 1 | Q10: 1 | R10: of:=[.Q10]+1 -> 2 | S10: of:=[.$B$6] + (([.R10]-1) * [.$B$7]) -> 60 | T10: of:=([.R10]/2)*([.$B$6]+[.S10]) -> 100 | U10: of:=[.T10]>=[.G10] -> true | V10: of:=[.Q10]*[.$B$9] -> 100 | W10: of:=[.F10]+[.V10] -> 2100 | X10: of:=[.W10]>=[.$B$1] -> false
E11: 9 | F11: of:=[.E11]*[.$B$3] -> 2250 | G11: of:=[.E11]*[.$B$4] -> 101.97 | J11: of:=[.$B$7] -> 20 | K11: of:=(2*[.$B$6])-[.$B$7] -> 60 | L11: of:=-2*[.T11] -> -360 | M11: of:=((-[.K11])+SQRT(([.K11]^2) - (4*[.J11]*[.L11])))/(2*[.J11]) -> 3 | N11: of:=[.M11]-1 -> 2 | Q11: 2 | R11: of:=[.Q11]+1 -> 3 | S11: of:=[.$B$6] + (([.R11]-1) * [.$B$7]) -> 80 | T11: of:=([.R11]/2)*([.$B$6]+[.S11]) -> 180 | U11: of:=[.T11]>=[.G11] -> true | V11: of:=[.Q11]*[.$B$9] -> 200 | W11: of:=[.F11]+[.V11] -> 2450 | X11: of:=[.W11]>=[.$B$1] -> false
E12: 10 | F12: of:=[.E12]*[.$B$3] -> 2500 | G12: of:=[.E12]*[.$B$4] -> 113.3 | J12: of:=[.$B$7] -> 20 | K12: of:=(2*[.$B$6])-[.$B$7] -> 60 | L12: of:=-2*[.T12] -> -360 | M12: of:=((-[.K12])+SQRT(([.K12]^2) - (4*[.J12]*[.L12])))/(2*[.J12]) -> 3 | N12: of:=[.M12]-1 -> 2 | Q12: 2 | R12: of:=[.Q12]+1 -> 3 | S12: of:=[.$B$6] + (([.R12]-1) * [.$B$7]) -> 80 | T12: of:=([.R12]/2)*([.$B$6]+[.S12]) -> 180 | U12: of:=[.T12]>=[.G12] -> true | V12: of:=[.Q12]*[.$B$9] -> 200 | W12: of:=[.F12]+[.V12] -> 2700 | X12: of:=[.W12]>=[.$B$1] -> false
E13: 11 | F13: of:=[.E13]*[.$B$3] -> 2750 | G13: of:=[.E13]*[.$B$4] -> 124.63 | J13: of:=[.$B$7] -> 20 | K13: of:=(2*[.$B$6])-[.$B$7] -> 60 | L13: of:=-2*[.T13] -> -360 | M13: of:=((-[.K13])+SQRT(([.K13]^2) - (4*[.J13]*[.L13])))/(2*[.J13]) -> 3 | N13: of:=[.M13]-1 -> 2 | Q13: 2 | R13: of:=[.Q13]+1 -> 3 | S13: of:=[.$B$6] + (([.R13]-1) * [.$B$7]) -> 80 | T13: of:=([.R13]/2)*([.$B$6]+[.S13]) -> 180 | U13: of:=[.T13]>=[.G13] -> true | V13: of:=[.Q13]*[.$B$9] -> 200 | W13: of:=[.F13]+[.V13] -> 2950 | X13: of:=[.W13]>=[.$B$1] -> false
E14: 12 | F14: of:=[.E14]*[.$B$3] -> 3000 | G14: of:=[.E14]*[.$B$4] -> 135.96 | J14: of:=[.$B$7] -> 20 | K14: of:=(2*[.$B$6])-[.$B$7] -> 60 | L14: of:=-2*[.T14] -> -360 | M14: of:=((-[.K14])+SQRT(([.K14]^2) - (4*[.J14]*[.L14])))/(2*[.J14]) -> 3 | N14: of:=[.M14]-1 -> 2 | Q14: 2 | R14: of:=[.Q14]+1 -> 3 | S14: of:=[.$B$6] + (([.R14]-1) * [.$B$7]) -> 80 | T14: of:=([.R14]/2)*([.$B$6]+[.S14]) -> 180 | U14: of:=[.T14]>=[.G14] -> true | V14: of:=[.Q14]*[.$B$9] -> 200 | W14: of:=[.F14]+[.V14] -> 3200 | X14: of:=[.W14]>=[.$B$1] -> false
E15: 13 | F15: of:=[.E15]*[.$B$3] -> 3250 | G15: of:=[.E15]*[.$B$4] -> 147.29 | J15: of:=[.$B$7] -> 20 | K15: of:=(2*[.$B$6])-[.$B$7] -> 60 | L15: of:=-2*[.T15] -> -360 | M15: of:=((-[.K15])+SQRT(([.K15]^2) - (4*[.J15]*[.L15])))/(2*[.J15]) -> 3 | N15: of:=[.M15]-1 -> 2 | Q15: 2 | R15: of:=[.Q15]+1 -> 3 | S15: of:=[.$B$6] + (([.R15]-1) * [.$B$7]) -> 80 | T15: of:=([.R15]/2)*([.$B$6]+[.S15]) -> 180 | U15: of:=[.T15]>=[.G15] -> true | V15: of:=[.Q15]*[.$B$9] -> 200 | W15: of:=[.F15]+[.V15] -> 3450 | X15: of:=[.W15]>=[.$B$1] -> false
E16: 14 | F16: of:=[.E16]*[.$B$3] -> 3500 | G16: of:=[.E16]*[.$B$4] -> 158.62 | J16: of:=[.$B$7] -> 20 | K16: of:=(2*[.$B$6])-[.$B$7] -> 60 | L16: of:=-2*[.T16] -> -360 | M16: of:=((-[.K16])+SQRT(([.K16]^2) - (4*[.J16]*[.L16])))/(2*[.J16]) -> 3 | N16: of:=[.M16]-1 -> 2 | Q16: 2 | R16: of:=[.Q16]+1 -> 3 | S16: of:=[.$B$6] + (([.R16]-1) * [.$B$7]) -> 80 | T16: of:=([.R16]/2)*([.$B$6]+[.S16]) -> 180 | U16: of:=[.T16]>=[.G16] -> true | V16: of:=[.Q16]*[.$B$9] -> 200 | W16: of:=[.F16]+[.V16] -> 3700 | X16: of:=[.W16]>=[.$B$1] -> false
E17: 15 | F17: of:=[.E17]*[.$B$3] -> 3750 | G17: of:=[.E17]*[.$B$4] -> 169.95 | J17: of:=[.$B$7] -> 20 | K17: of:=(2*[.$B$6])-[.$B$7] -> 60 | L17: of:=-2*[.T17] -> -360 | M17: of:=((-[.K17])+SQRT(([.K17]^2) - (4*[.J17]*[.L17])))/(2*[.J17]) -> 3 | N17: of:=[.M17]-1 -> 2 | Q17: 2 | R17: of:=[.Q17]+1 -> 3 | S17: of:=[.$B$6] + (([.R17]-1) * [.$B$7]) -> 80 | T17: of:=([.R17]/2)*([.$B$6]+[.S17]) -> 180 | U17: of:=[.T17]>=[.G17] -> true | V17: of:=[.Q17]*[.$B$9] -> 200 | W17: of:=[.F17]+[.V17] -> 3950 | X17: of:=[.W17]>=[.$B$1] -> false
E18: 16 | F18: of:=[.E18]*[.$B$3] -> 4000 | G18: of:=[.E18]*[.$B$4] -> 181.28 | J18: of:=[.$B$7] -> 20 | K18: of:=(2*[.$B$6])-[.$B$7] -> 60 | L18: of:=-2*[.T18] -> -560 | M18: of:=((-[.K18])+SQRT(([.K18]^2) - (4*[.J18]*[.L18])))/(2*[.J18]) -> 4 | N18: of:=[.M18]-1 -> 3 | Q18: 3 | R18: of:=[.Q18]+1 -> 4 | S18: of:=[.$B$6] + (([.R18]-1) * [.$B$7]) -> 100 | T18: of:=([.R18]/2)*([.$B$6]+[.S18]) -> 280 | U18: of:=[.T18]>=[.G18] -> true | V18: of:=[.Q18]*[.$B$9] -> 300 | W18: of:=[.F18]+[.V18] -> 4300 | X18: of:=[.W18]>=[.$B$1] -> false
E19: 17 | F19: of:=[.E19]*[.$B$3] -> 4250 | G19: of:=[.E19]*[.$B$4] -> 192.61 | J19: of:=[.$B$7] -> 20 | K19: of:=(2*[.$B$6])-[.$B$7] -> 60 | L19: of:=-2*[.T19] -> -560 | M19: of:=((-[.K19])+SQRT(([.K19]^2) - (4*[.J19]*[.L19])))/(2*[.J19]) -> 4 | N19: of:=[.M19]-1 -> 3 | Q19: 3 | R19: of:=[.Q19]+1 -> 4 | S19: of:=[.$B$6] + (([.R19]-1) * [.$B$7]) -> 100 | T19: of:=([.R19]/2)*([.$B$6]+[.S19]) -> 280 | U19: of:=[.T19]>=[.G19] -> true | V19: of:=[.Q19]*[.$B$9] -> 300 | W19: of:=[.F19]+[.V19] -> 4550 | X19: of:=[.W19]>=[.$B$1] -> false
E20: 18 | F20: of:=[.E20]*[.$B$3] -> 4500 | G20: of:=[.E20]*[.$B$4] -> 203.94 | J20: of:=[.$B$7] -> 20 | K20: of:=(2*[.$B$6])-[.$B$7] -> 60 | L20: of:=-2*[.T20] -> -560 | M20: of:=((-[.K20])+SQRT(([.K20]^2) - (4*[.J20]*[.L20])))/(2*[.J20]) -> 4 | N20: of:=[.M20]-1 -> 3 | Q20: 3 | R20: of:=[.Q20]+1 -> 4 | S20: of:=[.$B$6] + (([.R20]-1) * [.$B$7]) -> 100 | T20: of:=([.R20]/2)*([.$B$6]+[.S20]) -> 280 | U20: of:=[.T20]>=[.G20] -> true | V20: of:=[.Q20]*[.$B$9] -> 300 | W20: of:=[.F20]+[.V20] -> 4800 | X20: of:=[.W20]>=[.$B$1] -> false
E21: 19 | F21: of:=[.E21]*[.$B$3] -> 4750 | G21: of:=[.E21]*[.$B$4] -> 215.27 | J21: of:=[.$B$7] -> 20 | K21: of:=(2*[.$B$6])-[.$B$7] -> 60 | L21: of:=-2*[.T21] -> -560 | M21: of:=((-[.K21])+SQRT(([.K21]^2) - (4*[.J21]*[.L21])))/(2*[.J21]) -> 4 | N21: of:=[.M21]-1 -> 3 | Q21: 3 | R21: of:=[.Q21]+1 -> 4 | S21: of:=[.$B$6] + (([.R21]-1) * [.$B$7]) -> 100 | T21: of:=([.R21]/2)*([.$B$6]+[.S21]) -> 280 | U21: of:=[.T21]>=[.G21] -> true | V21: of:=[.Q21]*[.$B$9] -> 300 | W21: of:=[.F21]+[.V21] -> 5050 | X21: of:=[.W21]>=[.$B$1] -> false
E22: 20 | F22: of:=[.E22]*[.$B$3] -> 5000 | G22: of:=[.E22]*[.$B$4] -> 226.6 | J22: of:=[.$B$7] -> 20 | K22: of:=(2*[.$B$6])-[.$B$7] -> 60 | L22: of:=-2*[.T22] -> -560 | M22: of:=((-[.K22])+SQRT(([.K22]^2) - (4*[.J22]*[.L22])))/(2*[.J22]) -> 4 | N22: of:=[.M22]-1 -> 3 | Q22: 3 | R22: of:=[.Q22]+1 -> 4 | S22: of:=[.$B$6] + (([.R22]-1) * [.$B$7]) -> 100 | T22: of:=([.R22]/2)*([.$B$6]+[.S22]) -> 280 | U22: of:=[.T22]>=[.G22] -> true | V22: of:=[.Q22]*[.$B$9] -> 300 | W22: of:=[.F22]+[.V22] -> 5300 | X22: of:=[.W22]>=[.$B$1] -> false
E23: 21 | F23: of:=[.E23]*[.$B$3] -> 5250 | G23: of:=[.E23]*[.$B$4] -> 237.93 | J23: of:=[.$B$7] -> 20 | K23: of:=(2*[.$B$6])-[.$B$7] -> 60 | L23: of:=-2*[.T23] -> -560 | M23: of:=((-[.K23])+SQRT(([.K23]^2) - (4*[.J23]*[.L23])))/(2*[.J23]) -> 4 | N23: of:=[.M23]-1 -> 3 | Q23: 3 | R23: of:=[.Q23]+1 -> 4 | S23: of:=[.$B$6] + (([.R23]-1) * [.$B$7]) -> 100 | T23: of:=([.R23]/2)*([.$B$6]+[.S23]) -> 280 | U23: of:=[.T23]>=[.G23] -> true | V23: of:=[.Q23]*[.$B$9] -> 300 | W23: of:=[.F23]+[.V23] -> 5550 | X23: of:=[.W23]>=[.$B$1] -> false
E24: 22 | F24: of:=[.E24]*[.$B$3] -> 5500 | G24: of:=[.E24]*[.$B$4] -> 249.26 | J24: of:=[.$B$7] -> 20 | K24: of:=(2*[.$B$6])-[.$B$7] -> 60 | L24: of:=-2*[.T24] -> -560 | M24: of:=((-[.K24])+SQRT(([.K24]^2) - (4*[.J24]*[.L24])))/(2*[.J24]) -> 4 | N24: of:=[.M24]-1 -> 3 | Q24: 3 | R24: of:=[.Q24]+1 -> 4 | S24: of:=[.$B$6] + (([.R24]-1) * [.$B$7]) -> 100 | T24: of:=([.R24]/2)*([.$B$6]+[.S24]) -> 280 | U24: of:=[.T24]>=[.G24] -> true | V24: of:=[.Q24]*[.$B$9] -> 300 | W24: of:=[.F24]+[.V24] -> 5800 | X24: of:=[.W24]>=[.$B$1] -> false
E25: 23 | F25: of:=[.E25]*[.$B$3] -> 5750 | G25: of:=[.E25]*[.$B$4] -> 260.59 | J25: of:=[.$B$7] -> 20 | K25: of:=(2*[.$B$6])-[.$B$7] -> 60 | L25: of:=-2*[.T25] -> -560 | M25: of:=((-[.K25])+SQRT(([.K25]^2) - (4*[.J25]*[.L25])))/(2*[.J25]) -> 4 | N25: of:=[.M25]-1 -> 3 | Q25: 3 | R25: of:=[.Q25]+1 -> 4 | S25: of:=[.$B$6] + (([.R25]-1) * [.$B$7]) -> 100 | T25: of:=([.R25]/2)*([.$B$6]+[.S25]) -> 280 | U25: of:=[.T25]>=[.G25] -> true | V25: of:=[.Q25]*[.$B$9] -> 300 | W25: of:=[.F25]+[.V25] -> 6050 | X25: of:=[.W25]>=[.$B$1] -> false
E26: 24 | F26: of:=[.E26]*[.$B$3] -> 6000 | G26: of:=[.E26]*[.$B$4] -> 271.92 | J26: of:=[.$B$7] -> 20 | K26: of:=(2*[.$B$6])-[.$B$7] -> 60 | L26: of:=-2*[.T26] -> -560 | M26: of:=((-[.K26])+SQRT(([.K26]^2) - (4*[.J26]*[.L26])))/(2*[.J26]) -> 4 | N26: of:=[.M26]-1 -> 3 | Q26: 3 | R26: of:=[.Q26]+1 -> 4 | S26: of:=[.$B$6] + (([.R26]-1) * [.$B$7]) -> 100 | T26: of:=([.R26]/2)*([.$B$6]+[.S26]) -> 280 | U26: of:=[.T26]>=[.G26] -> true | V26: of:=[.Q26]*[.$B$9] -> 300 | W26: of:=[.F26]+[.V26] -> 6300 | X26: of:=[.W26]>=[.$B$1] -> false
E27: 25 | F27: of:=[.E27]*[.$B$3] -> 6250 | G27: of:=[.E27]*[.$B$4] -> 283.25 | J27: of:=[.$B$7] -> 20 | K27: of:=(2*[.$B$6])-[.$B$7] -> 60 | L27: of:=-2*[.T27] -> -800 | M27: of:=((-[.K27])+SQRT(([.K27]^2) - (4*[.J27]*[.L27])))/(2*[.J27]) -> 5 | N27: of:=[.M27]-1 -> 4 | Q27: 4 | R27: of:=[.Q27]+1 -> 5 | S27: of:=[.$B$6] + (([.R27]-1) * [.$B$7]) -> 120 | T27: of:=([.R27]/2)*([.$B$6]+[.S27]) -> 400 | U27: of:=[.T27]>=[.G27] -> true | V27: of:=[.Q27]*[.$B$9] -> 400 | W27: of:=[.F27]+[.V27] -> 6650 | X27: of:=[.W27]>=[.$B$1] -> false
E28: 26 | F28: of:=[.E28]*[.$B$3] -> 6500 | G28: of:=[.E28]*[.$B$4] -> 294.58 | J28: of:=[.$B$7] -> 20 | K28: of:=(2*[.$B$6])-[.$B$7] -> 60 | L28: of:=-2*[.T28] -> -800 | M28: of:=((-[.K28])+SQRT(([.K28]^2) - (4*[.J28]*[.L28])))/(2*[.J28]) -> 5 | N28: of:=[.M28]-1 -> 4 | Q28: 4 | R28: of:=[.Q28]+1 -> 5 | S28: of:=[.$B$6] + (([.R28]-1) * [.$B$7]) -> 120 | T28: of:=([.R28]/2)*([.$B$6]+[.S28]) -> 400 | U28: of:=[.T28]>=[.G28] -> true | V28: of:=[.Q28]*[.$B$9] -> 400 | W28: of:=[.F28]+[.V28] -> 6900 | X28: of:=[.W28]>=[.$B$1] -> false
E29: 27 | F29: of:=[.E29]*[.$B$3] -> 6750 | G29: of:=[.E29]*[.$B$4] -> 305.91 | J29: of:=[.$B$7] -> 20 | K29: of:=(2*[.$B$6])-[.$B$7] -> 60 | L29: of:=-2*[.T29] -> -800 | M29: of:=((-[.K29])+SQRT(([.K29]^2) - (4*[.J29]*[.L29])))/(2*[.J29]) -> 5 | N29: of:=[.M29]-1 -> 4 | Q29: 4 | R29: of:=[.Q29]+1 -> 5 | S29: of:=[.$B$6] + (([.R29]-1) * [.$B$7]) -> 120 | T29: of:=([.R29]/2)*([.$B$6]+[.S29]) -> 400 | U29: of:=[.T29]>=[.G29] -> true | V29: of:=[.Q29]*[.$B$9] -> 400 | W29: of:=[.F29]+[.V29] -> 7150 | X29: of:=[.W29]>=[.$B$1] -> false
E30: 28 | F30: of:=[.E30]*[.$B$3] -> 7000 | G30: of:=[.E30]*[.$B$4] -> 317.24 | J30: of:=[.$B$7] -> 20 | K30: of:=(2*[.$B$6])-[.$B$7] -> 60 | L30: of:=-2*[.T30] -> -800 | M30: of:=((-[.K30])+SQRT(([.K30]^2) - (4*[.J30]*[.L30])))/(2*[.J30]) -> 5 | N30: of:=[.M30]-1 -> 4 | Q30: 4 | R30: of:=[.Q30]+1 -> 5 | S30: of:=[.$B$6] + (([.R30]-1) * [.$B$7]) -> 120 | T30: of:=([.R30]/2)*([.$B$6]+[.S30]) -> 400 | U30: of:=[.T30]>=[.G30] -> true | V30: of:=[.Q30]*[.$B$9] -> 400 | W30: of:=[.F30]+[.V30] -> 7400 | X30: of:=[.W30]>=[.$B$1] -> false
E31: 29 | F31: of:=[.E31]*[.$B$3] -> 7250 | G31: of:=[.E31]*[.$B$4] -> 328.57 | J31: of:=[.$B$7] -> 20 | K31: of:=(2*[.$B$6])-[.$B$7] -> 60 | L31: of:=-2*[.T31] -> -800 | M31: of:=((-[.K31])+SQRT(([.K31]^2) - (4*[.J31]*[.L31])))/(2*[.J31]) -> 5 | N31: of:=[.M31]-1 -> 4 | Q31: 4 | R31: of:=[.Q31]+1 -> 5 | S31: of:=[.$B$6] + (([.R31]-1) * [.$B$7]) -> 120 | T31: of:=([.R31]/2)*([.$B$6]+[.S31]) -> 400 | U31: of:=[.T31]>=[.G31] -> true | V31: of:=[.Q31]*[.$B$9] -> 400 | W31: of:=[.F31]+[.V31] -> 7650 | X31: of:=[.W31]>=[.$B$1] -> false
E32: 30 | F32: of:=[.E32]*[.$B$3] -> 7500 | G32: of:=[.E32]*[.$B$4] -> 339.9 | J32: of:=[.$B$7] -> 20 | K32: of:=(2*[.$B$6])-[.$B$7] -> 60 | L32: of:=-2*[.T32] -> -800 | M32: of:=((-[.K32])+SQRT(([.K32]^2) - (4*[.J32]*[.L32])))/(2*[.J32]) -> 5 | N32: of:=[.M32]-1 -> 4 | Q32: 4 | R32: of:=[.Q32]+1 -> 5 | S32: of:=[.$B$6] + (([.R32]-1) * [.$B$7]) -> 120 | T32: of:=([.R32]/2)*([.$B$6]+[.S32]) -> 400 | U32: of:=[.T32]>=[.G32] -> true | V32: of:=[.Q32]*[.$B$9] -> 400 | W32: of:=[.F32]+[.V32] -> 7900 | X32: of:=[.W32]>=[.$B$1] -> false
E33: 31 | F33: of:=[.E33]*[.$B$3] -> 7750 | G33: of:=[.E33]*[.$B$4] -> 351.23 | J33: of:=[.$B$7] -> 20 | K33: of:=(2*[.$B$6])-[.$B$7] -> 60 | L33: of:=-2*[.T33] -> -800 | M33: of:=((-[.K33])+SQRT(([.K33]^2) - (4*[.J33]*[.L33])))/(2*[.J33]) -> 5 | N33: of:=[.M33]-1 -> 4 | Q33: 4 | R33: of:=[.Q33]+1 -> 5 | S33: of:=[.$B$6] + (([.R33]-1) * [.$B$7]) -> 120 | T33: of:=([.R33]/2)*([.$B$6]+[.S33]) -> 400 | U33: of:=[.T33]>=[.G33] -> true | V33: of:=[.Q33]*[.$B$9] -> 400 | W33: of:=[.F33]+[.V33] -> 8150 | X33: of:=[.W33]>=[.$B$1] -> false
E34: 32 | F34: of:=[.E34]*[.$B$3] -> 8000 | G34: of:=[.E34]*[.$B$4] -> 362.56 | J34: of:=[.$B$7] -> 20 | K34: of:=(2*[.$B$6])-[.$B$7] -> 60 | L34: of:=-2*[.T34] -> -800 | M34: of:=((-[.K34])+SQRT(([.K34]^2) - (4*[.J34]*[.L34])))/(2*[.J34]) -> 5 | N34: of:=[.M34]-1 -> 4 | Q34: 4 | R34: of:=[.Q34]+1 -> 5 | S34: of:=[.$B$6] + (([.R34]-1) * [.$B$7]) -> 120 | T34: of:=([.R34]/2)*([.$B$6]+[.S34]) -> 400 | U34: of:=[.T34]>=[.G34] -> true | V34: of:=[.Q34]*[.$B$9] -> 400 | W34: of:=[.F34]+[.V34] -> 8400 | X34: of:=[.W34]>=[.$B$1] -> false
E35: 33 | F35: of:=[.E35]*[.$B$3] -> 8250 | G35: of:=[.E35]*[.$B$4] -> 373.89 | J35: of:=[.$B$7] -> 20 | K35: of:=(2*[.$B$6])-[.$B$7] -> 60 | L35: of:=-2*[.T35] -> -800 | M35: of:=((-[.K35])+SQRT(([.K35]^2) - (4*[.J35]*[.L35])))/(2*[.J35]) -> 5 | N35: of:=[.M35]-1 -> 4 | Q35: 4 | R35: of:=[.Q35]+1 -> 5 | S35: of:=[.$B$6] + (([.R35]-1) * [.$B$7]) -> 120 | T35: of:=([.R35]/2)*([.$B$6]+[.S35]) -> 400 | U35: of:=[.T35]>=[.G35] -> true | V35: of:=[.Q35]*[.$B$9] -> 400 | W35: of:=[.F35]+[.V35] -> 8650 | X35: of:=[.W35]>=[.$B$1] -> false
E36: 34 | F36: of:=[.E36]*[.$B$3] -> 8500 | G36: of:=[.E36]*[.$B$4] -> 385.22 | J36: of:=[.$B$7] -> 20 | K36: of:=(2*[.$B$6])-[.$B$7] -> 60 | L36: of:=-2*[.T36] -> -800 | M36: of:=((-[.K36])+SQRT(([.K36]^2) - (4*[.J36]*[.L36])))/(2*[.J36]) -> 5 | N36: of:=[.M36]-1 -> 4 | Q36: 4 | R36: of:=[.Q36]+1 -> 5 | S36: of:=[.$B$6] + (([.R36]-1) * [.$B$7]) -> 120 | T36: of:=([.R36]/2)*([.$B$6]+[.S36]) -> 400 | U36: of:=[.T36]>=[.G36] -> true | V36: of:=[.Q36]*[.$B$9] -> 400 | W36: of:=[.F36]+[.V36] -> 8900 | X36: of:=[.W36]>=[.$B$1] -> false
E37: 35 | F37: of:=[.E37]*[.$B$3] -> 8750 | G37: of:=[.E37]*[.$B$4] -> 396.55 | J37: of:=[.$B$7] -> 20 | K37: of:=(2*[.$B$6])-[.$B$7] -> 60 | L37: of:=-2*[.T37] -> -800 | M37: of:=((-[.K37])+SQRT(([.K37]^2) - (4*[.J37]*[.L37])))/(2*[.J37]) -> 5 | N37: of:=[.M37]-1 -> 4 | Q37: 4 | R37: of:=[.Q37]+1 -> 5 | S37: of:=[.$B$6] + (([.R37]-1) * [.$B$7]) -> 120 | T37: of:=([.R37]/2)*([.$B$6]+[.S37]) -> 400 | U37: of:=[.T37]>=[.G37] -> true | V37: of:=[.Q37]*[.$B$9] -> 400 | W37: of:=[.F37]+[.V37] -> 9150 | X37: of:=[.W37]>=[.$B$1] -> false
E38: 36 | F38: of:=[.E38]*[.$B$3] -> 9000 | G38: of:=[.E38]*[.$B$4] -> 407.88 | J38: of:=[.$B$7] -> 20 | K38: of:=(2*[.$B$6])-[.$B$7] -> 60 | L38: of:=-2*[.T38] -> -1080 | M38: of:=((-[.K38])+SQRT(([.K38]^2) - (4*[.J38]*[.L38])))/(2*[.J38]) -> 6 | N38: of:=[.M38]-1 -> 5 | Q38: 5 | R38: of:=[.Q38]+1 -> 6 | S38: of:=[.$B$6] + (([.R38]-1) * [.$B$7]) -> 140 | T38: of:=([.R38]/2)*([.$B$6]+[.S38]) -> 540 | U38: of:=[.T38]>=[.G38] -> true | V38: of:=[.Q38]*[.$B$9] -> 500 | W38: of:=[.F38]+[.V38] -> 9500 | X38: of:=[.W38]>=[.$B$1] -> false
E39: 37 | F39: of:=[.E39]*[.$B$3] -> 9250 | G39: of:=[.E39]*[.$B$4] -> 419.21 | J39: of:=[.$B$7] -> 20 | K39: of:=(2*[.$B$6])-[.$B$7] -> 60 | L39: of:=-2*[.T39] -> -1080 | M39: of:=((-[.K39])+SQRT(([.K39]^2) - (4*[.J39]*[.L39])))/(2*[.J39]) -> 6 | N39: of:=[.M39]-1 -> 5 | Q39: 5 | R39: of:=[.Q39]+1 -> 6 | S39: of:=[.$B$6] + (([.R39]-1) * [.$B$7]) -> 140 | T39: of:=([.R39]/2)*([.$B$6]+[.S39]) -> 540 | U39: of:=[.T39]>=[.G39] -> true | V39: of:=[.Q39]*[.$B$9] -> 500 | W39: of:=[.F39]+[.V39] -> 9750 | X39: of:=[.W39]>=[.$B$1] -> false
E40: 38 | F40: of:=[.E40]*[.$B$3] -> 9500 | G40: of:=[.E40]*[.$B$4] -> 430.54 | J40: of:=[.$B$7] -> 20 | K40: of:=(2*[.$B$6])-[.$B$7] -> 60 | L40: of:=-2*[.T40] -> -1080 | M40: of:=((-[.K40])+SQRT(([.K40]^2) - (4*[.J40]*[.L40])))/(2*[.J40]) -> 6 | N40: of:=[.M40]-1 -> 5 | Q40: 5 | R40: of:=[.Q40]+1 -> 6 | S40: of:=[.$B$6] + (([.R40]-1) * [.$B$7]) -> 140 | T40: of:=([.R40]/2)*([.$B$6]+[.S40]) -> 540 | U40: of:=[.T40]>=[.G40] -> true | V40: of:=[.Q40]*[.$B$9] -> 500 | W40: of:=[.F40]+[.V40] -> 10000 | X40: of:=[.W40]>=[.$B$1] -> false
E41: 39 | F41: of:=[.E41]*[.$B$3] -> 9750 | G41: of:=[.E41]*[.$B$4] -> 441.87 | J41: of:=[.$B$7] -> 20 | K41: of:=(2*[.$B$6])-[.$B$7] -> 60 | L41: of:=-2*[.T41] -> -1080 | M41: of:=((-[.K41])+SQRT(([.K41]^2) - (4*[.J41]*[.L41])))/(2*[.J41]) -> 6 | N41: of:=[.M41]-1 -> 5 | Q41: 5 | R41: of:=[.Q41]+1 -> 6 | S41: of:=[.$B$6] + (([.R41]-1) * [.$B$7]) -> 140 | T41: of:=([.R41]/2)*([.$B$6]+[.S41]) -> 540 | U41: of:=[.T41]>=[.G41] -> true | V41: of:=[.Q41]*[.$B$9] -> 500 | W41: of:=[.F41]+[.V41] -> 10250 | X41: of:=[.W41]>=[.$B$1] -> false
E42: 40 | F42: of:=[.E42]*[.$B$3] -> 10000 | G42: of:=[.E42]*[.$B$4] -> 453.2 | J42: of:=[.$B$7] -> 20 | K42: of:=(2*[.$B$6])-[.$B$7] -> 60 | L42: of:=-2*[.T42] -> -1080 | M42: of:=((-[.K42])+SQRT(([.K42]^2) - (4*[.J42]*[.L42])))/(2*[.J42]) -> 6 | N42: of:=[.M42]-1 -> 5 | Q42: 5 | R42: of:=[.Q42]+1 -> 6 | S42: of:=[.$B$6] + (([.R42]-1) * [.$B$7]) -> 140 | T42: of:=([.R42]/2)*([.$B$6]+[.S42]) -> 540 | U42: of:=[.T42]>=[.G42] -> true | V42: of:=[.Q42]*[.$B$9] -> 500 | W42: of:=[.F42]+[.V42] -> 10500 | X42: of:=[.W42]>=[.$B$1] -> false
E43: 41 | F43: of:=[.E43]*[.$B$3] -> 10250 | G43: of:=[.E43]*[.$B$4] -> 464.53 | J43: of:=[.$B$7] -> 20 | K43: of:=(2*[.$B$6])-[.$B$7] -> 60 | L43: of:=-2*[.T43] -> -1080 | M43: of:=((-[.K43])+SQRT(([.K43]^2) - (4*[.J43]*[.L43])))/(2*[.J43]) -> 6 | N43: of:=[.M43]-1 -> 5 | Q43: 5 | R43: of:=[.Q43]+1 -> 6 | S43: of:=[.$B$6] + (([.R43]-1) * [.$B$7]) -> 140 | T43: of:=([.R43]/2)*([.$B$6]+[.S43]) -> 540 | U43: of:=[.T43]>=[.G43] -> true | V43: of:=[.Q43]*[.$B$9] -> 500 | W43: of:=[.F43]+[.V43] -> 10750 | X43: of:=[.W43]>=[.$B$1] -> false
E44: 42 | F44: of:=[.E44]*[.$B$3] -> 10500 | G44: of:=[.E44]*[.$B$4] -> 475.86 | J44: of:=[.$B$7] -> 20 | K44: of:=(2*[.$B$6])-[.$B$7] -> 60 | L44: of:=-2*[.T44] -> -1080 | M44: of:=((-[.K44])+SQRT(([.K44]^2) - (4*[.J44]*[.L44])))/(2*[.J44]) -> 6 | N44: of:=[.M44]-1 -> 5 | Q44: 5 | R44: of:=[.Q44]+1 -> 6 | S44: of:=[.$B$6] + (([.R44]-1) * [.$B$7]) -> 140 | T44: of:=([.R44]/2)*([.$B$6]+[.S44]) -> 540 | U44: of:=[.T44]>=[.G44] -> true | V44: of:=[.Q44]*[.$B$9] -> 500 | W44: of:=[.F44]+[.V44] -> 11000 | X44: of:=[.W44]>=[.$B$1] -> false
E45: 43 | F45: of:=[.E45]*[.$B$3] -> 10750 | G45: of:=[.E45]*[.$B$4] -> 487.19 | J45: of:=[.$B$7] -> 20 | K45: of:=(2*[.$B$6])-[.$B$7] -> 60 | L45: of:=-2*[.T45] -> -1080 | M45: of:=((-[.K45])+SQRT(([.K45]^2) - (4*[.J45]*[.L45])))/(2*[.J45]) -> 6 | N45: of:=[.M45]-1 -> 5 | Q45: 5 | R45: of:=[.Q45]+1 -> 6 | S45: of:=[.$B$6] + (([.R45]-1) * [.$B$7]) -> 140 | T45: of:=([.R45]/2)*([.$B$6]+[.S45]) -> 540 | U45: of:=[.T45]>=[.G45] -> true | V45: of:=[.Q45]*[.$B$9] -> 500 | W45: of:=[.F45]+[.V45] -> 11250 | X45: of:=[.W45]>=[.$B$1] -> false
E46: 44 | F46: of:=[.E46]*[.$B$3] -> 11000 | G46: of:=[.E46]*[.$B$4] -> 498.52 | J46: of:=[.$B$7] -> 20 | K46: of:=(2*[.$B$6])-[.$B$7] -> 60 | L46: of:=-2*[.T46] -> -1080 | M46: of:=((-[.K46])+SQRT(([.K46]^2) - (4*[.J46]*[.L46])))/(2*[.J46]) -> 6 | N46: of:=[.M46]-1 -> 5 | Q46: 5 | R46: of:=[.Q46]+1 -> 6 | S46: of:=[.$B$6] + (([.R46]-1) * [.$B$7]) -> 140 | T46: of:=([.R46]/2)*([.$B$6]+[.S46]) -> 540 | U46: of:=[.T46]>=[.G46] -> true | V46: of:=[.Q46]*[.$B$9] -> 500 | W46: of:=[.F46]+[.V46] -> 11500 | X46: of:=[.W46]>=[.$B$1] -> false
E47: 45 | F47: of:=[.E47]*[.$B$3] -> 11250 | G47: of:=[.E47]*[.$B$4] -> 509.85 | J47: of:=[.$B$7] -> 20 | K47: of:=(2*[.$B$6])-[.$B$7] -> 60 | L47: of:=-2*[.T47] -> -1080 | M47: of:=((-[.K47])+SQRT(([.K47]^2) - (4*[.J47]*[.L47])))/(2*[.J47]) -> 6 | N47: of:=[.M47]-1 -> 5 | Q47: 5 | R47: of:=[.Q47]+1 -> 6 | S47: of:=[.$B$6] + (([.R47]-1) * [.$B$7]) -> 140 | T47: of:=([.R47]/2)*([.$B$6]+[.S47]) -> 540 | U47: of:=[.T47]>=[.G47] -> true | V47: of:=[.Q47]*[.$B$9] -> 500 | W47: of:=[.F47]+[.V47] -> 11750 | X47: of:=[.W47]>=[.$B$1] -> false
E48: 46 | F48: of:=[.E48]*[.$B$3] -> 11500 | G48: of:=[.E48]*[.$B$4] -> 521.18 | J48: of:=[.$B$7] -> 20 | K48: of:=(2*[.$B$6])-[.$B$7] -> 60 | L48: of:=-2*[.T48] -> -1080 | M48: of:=((-[.K48])+SQRT(([.K48]^2) - (4*[.J48]*[.L48])))/(2*[.J48]) -> 6 | N48: of:=[.M48]-1 -> 5 | Q48: 5 | R48: of:=[.Q48]+1 -> 6 | S48: of:=[.$B$6] + (([.R48]-1) * [.$B$7]) -> 140 | T48: of:=([.R48]/2)*([.$B$6]+[.S48]) -> 540 | U48: of:=[.T48]>=[.G48] -> true | V48: of:=[.Q48]*[.$B$9] -> 500 | W48: of:=[.F48]+[.V48] -> 12000 | X48: of:=[.W48]>=[.$B$1] -> false
E49: 47 | F49: of:=[.E49]*[.$B$3] -> 11750 | G49: of:=[.E49]*[.$B$4] -> 532.51 | J49: of:=[.$B$7] -> 20 | K49: of:=(2*[.$B$6])-[.$B$7] -> 60 | L49: of:=-2*[.T49] -> -1080 | M49: of:=((-[.K49])+SQRT(([.K49]^2) - (4*[.J49]*[.L49])))/(2*[.J49]) -> 6 | N49: of:=[.M49]-1 -> 5 | Q49: 5 | R49: of:=[.Q49]+1 -> 6 | S49: of:=[.$B$6] + (([.R49]-1) * [.$B$7]) -> 140 | T49: of:=([.R49]/2)*([.$B$6]+[.S49]) -> 540 | U49: of:=[.T49]>=[.G49] -> true | V49: of:=[.Q49]*[.$B$9] -> 500 | W49: of:=[.F49]+[.V49] -> 12250 | X49: of:=[.W49]>=[.$B$1] -> false
E50: 48 | F50: of:=[.E50]*[.$B$3] -> 12000 | G50: of:=[.E50]*[.$B$4] -> 543.84 | J50: of:=[.$B$7] -> 20 | K50: of:=(2*[.$B$6])-[.$B$7] -> 60 | L50: of:=-2*[.T50] -> -1400 | M50: of:=((-[.K50])+SQRT(([.K50]^2) - (4*[.J50]*[.L50])))/(2*[.J50]) -> 7 | N50: of:=[.M50]-1 -> 6 | Q50: 6 | R50: of:=[.Q50]+1 -> 7 | S50: of:=[.$B$6] + (([.R50]-1) * [.$B$7]) -> 160 | T50: of:=([.R50]/2)*([.$B$6]+[.S50]) -> 700 | U50: of:=[.T50]>=[.G50] -> true | V50: of:=[.Q50]*[.$B$9] -> 600 | W50: of:=[.F50]+[.V50] -> 12600 | X50: of:=[.W50]>=[.$B$1] -> false
E51: 49 | F51: of:=[.E51]*[.$B$3] -> 12250 | G51: of:=[.E51]*[.$B$4] -> 555.17 | J51: of:=[.$B$7] -> 20 | K51: of:=(2*[.$B$6])-[.$B$7] -> 60 | L51: of:=-2*[.T51] -> -1400 | M51: of:=((-[.K51])+SQRT(([.K51]^2) - (4*[.J51]*[.L51])))/(2*[.J51]) -> 7 | N51: of:=[.M51]-1 -> 6 | Q51: 6 | R51: of:=[.Q51]+1 -> 7 | S51: of:=[.$B$6] + (([.R51]-1) * [.$B$7]) -> 160 | T51: of:=([.R51]/2)*([.$B$6]+[.S51]) -> 700 | U51: of:=[.T51]>=[.G51] -> true | V51: of:=[.Q51]*[.$B$9] -> 600 | W51: of:=[.F51]+[.V51] -> 12850 | X51: of:=[.W51]>=[.$B$1] -> false
E52: 50 | F52: of:=[.E52]*[.$B$3] -> 12500 | G52: of:=[.E52]*[.$B$4] -> 566.5 | J52: of:=[.$B$7] -> 20 | K52: of:=(2*[.$B$6])-[.$B$7] -> 60 | L52: of:=-2*[.T52] -> -1400 | M52: of:=((-[.K52])+SQRT(([.K52]^2) - (4*[.J52]*[.L52])))/(2*[.J52]) -> 7 | N52: of:=[.M52]-1 -> 6 | Q52: 6 | R52: of:=[.Q52]+1 -> 7 | S52: of:=[.$B$6] + (([.R52]-1) * [.$B$7]) -> 160 | T52: of:=([.R52]/2)*([.$B$6]+[.S52]) -> 700 | U52: of:=[.T52]>=[.G52] -> true | V52: of:=[.Q52]*[.$B$9] -> 600 | W52: of:=[.F52]+[.V52] -> 13100 | X52: of:=[.W52]>=[.$B$1] -> false
E53: 51 | F53: of:=[.E53]*[.$B$3] -> 12750 | G53: of:=[.E53]*[.$B$4] -> 577.83 | J53: of:=[.$B$7] -> 20 | K53: of:=(2*[.$B$6])-[.$B$7] -> 60 | L53: of:=-2*[.T53] -> -1400 | M53: of:=((-[.K53])+SQRT(([.K53]^2) - (4*[.J53]*[.L53])))/(2*[.J53]) -> 7 | N53: of:=[.M53]-1 -> 6 | Q53: 6 | R53: of:=[.Q53]+1 -> 7 | S53: of:=[.$B$6] + (([.R53]-1) * [.$B$7]) -> 160 | T53: of:=([.R53]/2)*([.$B$6]+[.S53]) -> 700 | U53: of:=[.T53]>=[.G53] -> true | V53: of:=[.Q53]*[.$B$9] -> 600 | W53: of:=[.F53]+[.V53] -> 13350 | X53: of:=[.W53]>=[.$B$1] -> false
E54: 52 | F54: of:=[.E54]*[.$B$3] -> 13000 | G54: of:=[.E54]*[.$B$4] -> 589.16 | J54: of:=[.$B$7] -> 20 | K54: of:=(2*[.$B$6])-[.$B$7] -> 60 | L54: of:=-2*[.T54] -> -1400 | M54: of:=((-[.K54])+SQRT(([.K54]^2) - (4*[.J54]*[.L54])))/(2*[.J54]) -> 7 | N54: of:=[.M54]-1 -> 6 | Q54: 6 | R54: of:=[.Q54]+1 -> 7 | S54: of:=[.$B$6] + (([.R54]-1) * [.$B$7]) -> 160 | T54: of:=([.R54]/2)*([.$B$6]+[.S54]) -> 700 | U54: of:=[.T54]>=[.G54] -> true | V54: of:=[.Q54]*[.$B$9] -> 600 | W54: of:=[.F54]+[.V54] -> 13600 | X54: of:=[.W54]>=[.$B$1] -> false
E55: 53 | F55: of:=[.E55]*[.$B$3] -> 13250 | G55: of:=[.E55]*[.$B$4] -> 600.49 | J55: of:=[.$B$7] -> 20 | K55: of:=(2*[.$B$6])-[.$B$7] -> 60 | L55: of:=-2*[.T55] -> -1400 | M55: of:=((-[.K55])+SQRT(([.K55]^2) - (4*[.J55]*[.L55])))/(2*[.J55]) -> 7 | N55: of:=[.M55]-1 -> 6 | Q55: 6 | R55: of:=[.Q55]+1 -> 7 | S55: of:=[.$B$6] + (([.R55]-1) * [.$B$7]) -> 160 | T55: of:=([.R55]/2)*([.$B$6]+[.S55]) -> 700 | U55: of:=[.T55]>=[.G55] -> true | V55: of:=[.Q55]*[.$B$9] -> 600 | W55: of:=[.F55]+[.V55] -> 13850 | X55: of:=[.W55]>=[.$B$1] -> false
E56: 54 | F56: of:=[.E56]*[.$B$3] -> 13500 | G56: of:=[.E56]*[.$B$4] -> 611.82 | J56: of:=[.$B$7] -> 20 | K56: of:=(2*[.$B$6])-[.$B$7] -> 60 | L56: of:=-2*[.T56] -> -1400 | M56: of:=((-[.K56])+SQRT(([.K56]^2) - (4*[.J56]*[.L56])))/(2*[.J56]) -> 7 | N56: of:=[.M56]-1 -> 6 | Q56: 6 | R56: of:=[.Q56]+1 -> 7 | S56: of:=[.$B$6] + (([.R56]-1) * [.$B$7]) -> 160 | T56: of:=([.R56]/2)*([.$B$6]+[.S56]) -> 700 | U56: of:=[.T56]>=[.G56] -> true | V56: of:=[.Q56]*[.$B$9] -> 600 | W56: of:=[.F56]+[.V56] -> 14100 | X56: of:=[.W56]>=[.$B$1] -> false
E57: 55 | F57: of:=[.E57]*[.$B$3] -> 13750 | G57: of:=[.E57]*[.$B$4] -> 623.15 | J57: of:=[.$B$7] -> 20 | K57: of:=(2*[.$B$6])-[.$B$7] -> 60 | L57: of:=-2*[.T57] -> -1400 | M57: of:=((-[.K57])+SQRT(([.K57]^2) - (4*[.J57]*[.L57])))/(2*[.J57]) -> 7 | N57: of:=[.M57]-1 -> 6 | Q57: 6 | R57: of:=[.Q57]+1 -> 7 | S57: of:=[.$B$6] + (([.R57]-1) * [.$B$7]) -> 160 | T57: of:=([.R57]/2)*([.$B$6]+[.S57]) -> 700 | U57: of:=[.T57]>=[.G57] -> true | V57: of:=[.Q57]*[.$B$9] -> 600 | W57: of:=[.F57]+[.V57] -> 14350 | X57: of:=[.W57]>=[.$B$1] -> false
E58: 56 | F58: of:=[.E58]*[.$B$3] -> 14000 | G58: of:=[.E58]*[.$B$4] -> 634.48 | J58: of:=[.$B$7] -> 20 | K58: of:=(2*[.$B$6])-[.$B$7] -> 60 | L58: of:=-2*[.T58] -> -1400 | M58: of:=((-[.K58])+SQRT(([.K58]^2) - (4*[.J58]*[.L58])))/(2*[.J58]) -> 7 | N58: of:=[.M58]-1 -> 6 | Q58: 6 | R58: of:=[.Q58]+1 -> 7 | S58: of:=[.$B$6] + (([.R58]-1) * [.$B$7]) -> 160 | T58: of:=([.R58]/2)*([.$B$6]+[.S58]) -> 700 | U58: of:=[.T58]>=[.G58] -> true | V58: of:=[.Q58]*[.$B$9] -> 600 | W58: of:=[.F58]+[.V58] -> 14600 | X58: of:=[.W58]>=[.$B$1] -> false
E59: 57 | F59: of:=[.E59]*[.$B$3] -> 14250 | G59: of:=[.E59]*[.$B$4] -> 645.81 | J59: of:=[.$B$7] -> 20 | K59: of:=(2*[.$B$6])-[.$B$7] -> 60 | L59: of:=-2*[.T59] -> -1400 | M59: of:=((-[.K59])+SQRT(([.K59]^2) - (4*[.J59]*[.L59])))/(2*[.J59]) -> 7 | N59: of:=[.M59]-1 -> 6 | Q59: 6 | R59: of:=[.Q59]+1 -> 7 | S59: of:=[.$B$6] + (([.R59]-1) * [.$B$7]) -> 160 | T59: of:=([.R59]/2)*([.$B$6]+[.S59]) -> 700 | U59: of:=[.T59]>=[.G59] -> true | V59: of:=[.Q59]*[.$B$9] -> 600 | W59: of:=[.F59]+[.V59] -> 14850 | X59: of:=[.W59]>=[.$B$1] -> false
E60: 58 | F60: of:=[.E60]*[.$B$3] -> 14500 | G60: of:=[.E60]*[.$B$4] -> 657.14 | J60: of:=[.$B$7] -> 20 | K60: of:=(2*[.$B$6])-[.$B$7] -> 60 | L60: of:=-2*[.T60] -> -1400 | M60: of:=((-[.K60])+SQRT(([.K60]^2) - (4*[.J60]*[.L60])))/(2*[.J60]) -> 7 | N60: of:=[.M60]-1 -> 6 | Q60: 6 | R60: of:=[.Q60]+1 -> 7 | S60: of:=[.$B$6] + (([.R60]-1) * [.$B$7]) -> 160 | T60: of:=([.R60]/2)*([.$B$6]+[.S60]) -> 700 | U60: of:=[.T60]>=[.G60] -> true | V60: of:=[.Q60]*[.$B$9] -> 600 | W60: of:=[.F60]+[.V60] -> 15100 | X60: of:=[.W60]>=[.$B$1] -> false
E61: 59 | F61: of:=[.E61]*[.$B$3] -> 14750 | G61: of:=[.E61]*[.$B$4] -> 668.47 | J61: of:=[.$B$7] -> 20 | K61: of:=(2*[.$B$6])-[.$B$7] -> 60 | L61: of:=-2*[.T61] -> -1400 | M61: of:=((-[.K61])+SQRT(([.K61]^2) - (4*[.J61]*[.L61])))/(2*[.J61]) -> 7 | N61: of:=[.M61]-1 -> 6 | Q61: 6 | R61: of:=[.Q61]+1 -> 7 | S61: of:=[.$B$6] + (([.R61]-1) * [.$B$7]) -> 160 | T61: of:=([.R61]/2)*([.$B$6]+[.S61]) -> 700 | U61: of:=[.T61]>=[.G61] -> true | V61: of:=[.Q61]*[.$B$9] -> 600 | W61: of:=[.F61]+[.V61] -> 15350 | X61: of:=[.W61]>=[.$B$1] -> false
E62: 60 | F62: of:=[.E62]*[.$B$3] -> 15000 | G62: of:=[.E62]*[.$B$4] -> 679.8 | J62: of:=[.$B$7] -> 20 | K62: of:=(2*[.$B$6])-[.$B$7] -> 60 | L62: of:=-2*[.T62] -> -1400 | M62: of:=((-[.K62])+SQRT(([.K62]^2) - (4*[.J62]*[.L62])))/(2*[.J62]) -> 7 | N62: of:=[.M62]-1 -> 6 | Q62: 6 | R62: of:=[.Q62]+1 -> 7 | S62: of:=[.$B$6] + (([.R62]-1) * [.$B$7]) -> 160 | T62: of:=([.R62]/2)*([.$B$6]+[.S62]) -> 700 | U62: of:=[.T62]>=[.G62] -> true | V62: of:=[.Q62]*[.$B$9] -> 600 | W62: of:=[.F62]+[.V62] -> 15600 | X62: of:=[.W62]>=[.$B$1] -> false
E63: 61 | F63: of:=[.E63]*[.$B$3] -> 15250 | G63: of:=[.E63]*[.$B$4] -> 691.13 | J63: of:=[.$B$7] -> 20 | K63: of:=(2*[.$B$6])-[.$B$7] -> 60 | L63: of:=-2*[.T63] -> -1400 | M63: of:=((-[.K63])+SQRT(([.K63]^2) - (4*[.J63]*[.L63])))/(2*[.J63]) -> 7 | N63: of:=[.M63]-1 -> 6 | Q63: 6 | R63: of:=[.Q63]+1 -> 7 | S63: of:=[.$B$6] + (([.R63]-1) * [.$B$7]) -> 160 | T63: of:=([.R63]/2)*([.$B$6]+[.S63]) -> 700 | U63: of:=[.T63]>=[.G63] -> true | V63: of:=[.Q63]*[.$B$9] -> 600 | W63: of:=[.F63]+[.V63] -> 15850 | X63: of:=[.W63]>=[.$B$1] -> false
E64: 62 | F64: of:=[.E64]*[.$B$3] -> 15500 | G64: of:=[.E64]*[.$B$4] -> 702.46 | J64: of:=[.$B$7] -> 20 | K64: of:=(2*[.$B$6])-[.$B$7] -> 60 | L64: of:=-2*[.T64] -> -1760 | M64: of:=((-[.K64])+SQRT(([.K64]^2) - (4*[.J64]*[.L64])))/(2*[.J64]) -> 8 | N64: of:=[.M64]-1 -> 7 | Q64: 7 | R64: of:=[.Q64]+1 -> 8 | S64: of:=[.$B$6] + (([.R64]-1) * [.$B$7]) -> 180 | T64: of:=([.R64]/2)*([.$B$6]+[.S64]) -> 880 | U64: of:=[.T64]>=[.G64] -> true | V64: of:=[.Q64]*[.$B$9] -> 700 | W64: of:=[.F64]+[.V64] -> 16200 | X64: of:=[.W64]>=[.$B$1] -> false
E65: 63 | F65: of:=[.E65]*[.$B$3] -> 15750 | G65: of:=[.E65]*[.$B$4] -> 713.79 | J65: of:=[.$B$7] -> 20 | K65: of:=(2*[.$B$6])-[.$B$7] -> 60 | L65: of:=-2*[.T65] -> -1760 | M65: of:=((-[.K65])+SQRT(([.K65]^2) - (4*[.J65]*[.L65])))/(2*[.J65]) -> 8 | N65: of:=[.M65]-1 -> 7 | Q65: 7 | R65: of:=[.Q65]+1 -> 8 | S65: of:=[.$B$6] + (([.R65]-1) * [.$B$7]) -> 180 | T65: of:=([.R65]/2)*([.$B$6]+[.S65]) -> 880 | U65: of:=[.T65]>=[.G65] -> true | V65: of:=[.Q65]*[.$B$9] -> 700 | W65: of:=[.F65]+[.V65] -> 16450 | X65: of:=[.W65]>=[.$B$1] -> false
E66: 64 | F66: of:=[.E66]*[.$B$3] -> 16000 | G66: of:=[.E66]*[.$B$4] -> 725.12 | J66: of:=[.$B$7] -> 20 | K66: of:=(2*[.$B$6])-[.$B$7] -> 60 | L66: of:=-2*[.T66] -> -1760 | M66: of:=((-[.K66])+SQRT(([.K66]^2) - (4*[.J66]*[.L66])))/(2*[.J66]) -> 8 | N66: of:=[.M66]-1 -> 7 | Q66: 7 | R66: of:=[.Q66]+1 -> 8 | S66: of:=[.$B$6] + (([.R66]-1) * [.$B$7]) -> 180 | T66: of:=([.R66]/2)*([.$B$6]+[.S66]) -> 880 | U66: of:=[.T66]>=[.G66] -> true | V66: of:=[.Q66]*[.$B$9] -> 700 | W66: of:=[.F66]+[.V66] -> 16700 | X66: of:=[.W66]>=[.$B$1] -> false
E67: 65 | F67: of:=[.E67]*[.$B$3] -> 16250 | G67: of:=[.E67]*[.$B$4] -> 736.45 | J67: of:=[.$B$7] -> 20 | K67: of:=(2*[.$B$6])-[.$B$7] -> 60 | L67: of:=-2*[.T67] -> -1760 | M67: of:=((-[.K67])+SQRT(([.K67]^2) - (4*[.J67]*[.L67])))/(2*[.J67]) -> 8 | N67: of:=[.M67]-1 -> 7 | Q67: 7 | R67: of:=[.Q67]+1 -> 8 | S67: of:=[.$B$6] + (([.R67]-1) * [.$B$7]) -> 180 | T67: of:=([.R67]/2)*([.$B$6]+[.S67]) -> 880 | U67: of:=[.T67]>=[.G67] -> true | V67: of:=[.Q67]*[.$B$9] -> 700 | W67: of:=[.F67]+[.V67] -> 16950 | X67: of:=[.W67]>=[.$B$1] -> false
E68: 66 | F68: of:=[.E68]*[.$B$3] -> 16500 | G68: of:=[.E68]*[.$B$4] -> 747.78 | J68: of:=[.$B$7] -> 20 | K68: of:=(2*[.$B$6])-[.$B$7] -> 60 | L68: of:=-2*[.T68] -> -1760 | M68: of:=((-[.K68])+SQRT(([.K68]^2) - (4*[.J68]*[.L68])))/(2*[.J68]) -> 8 | N68: of:=[.M68]-1 -> 7 | Q68: 7 | R68: of:=[.Q68]+1 -> 8 | S68: of:=[.$B$6] + (([.R68]-1) * [.$B$7]) -> 180 | T68: of:=([.R68]/2)*([.$B$6]+[.S68]) -> 880 | U68: of:=[.T68]>=[.G68] -> true | V68: of:=[.Q68]*[.$B$9] -> 700 | W68: of:=[.F68]+[.V68] -> 17200 | X68: of:=[.W68]>=[.$B$1] -> false
E69: 67 | F69: of:=[.E69]*[.$B$3] -> 16750 | G69: of:=[.E69]*[.$B$4] -> 759.11 | J69: of:=[.$B$7] -> 20 | K69: of:=(2*[.$B$6])-[.$B$7] -> 60 | L69: of:=-2*[.T69] -> -1760 | M69: of:=((-[.K69])+SQRT(([.K69]^2) - (4*[.J69]*[.L69])))/(2*[.J69]) -> 8 | N69: of:=[.M69]-1 -> 7 | Q69: 7 | R69: of:=[.Q69]+1 -> 8 | S69: of:=[.$B$6] + (([.R69]-1) * [.$B$7]) -> 180 | T69: of:=([.R69]/2)*([.$B$6]+[.S69]) -> 880 | U69: of:=[.T69]>=[.G69] -> true | V69: of:=[.Q69]*[.$B$9] -> 700 | W69: of:=[.F69]+[.V69] -> 17450 | X69: of:=[.W69]>=[.$B$1] -> false
E70: 68 | F70: of:=[.E70]*[.$B$3] -> 17000 | G70: of:=[.E70]*[.$B$4] -> 770.44 | J70: of:=[.$B$7] -> 20 | K70: of:=(2*[.$B$6])-[.$B$7] -> 60 | L70: of:=-2*[.T70] -> -1760 | M70: of:=((-[.K70])+SQRT(([.K70]^2) - (4*[.J70]*[.L70])))/(2*[.J70]) -> 8 | N70: of:=[.M70]-1 -> 7 | Q70: 7 | R70: of:=[.Q70]+1 -> 8 | S70: of:=[.$B$6] + (([.R70]-1) * [.$B$7]) -> 180 | T70: of:=([.R70]/2)*([.$B$6]+[.S70]) -> 880 | U70: of:=[.T70]>=[.G70] -> true | V70: of:=[.Q70]*[.$B$9] -> 700 | W70: of:=[.F70]+[.V70] -> 17700 | X70: of:=[.W70]>=[.$B$1] -> false
E71: 69 | F71: of:=[.E71]*[.$B$3] -> 17250 | G71: of:=[.E71]*[.$B$4] -> 781.77 | J71: of:=[.$B$7] -> 20 | K71: of:=(2*[.$B$6])-[.$B$7] -> 60 | L71: of:=-2*[.T71] -> -1760 | M71: of:=((-[.K71])+SQRT(([.K71]^2) - (4*[.J71]*[.L71])))/(2*[.J71]) -> 8 | N71: of:=[.M71]-1 -> 7 | Q71: 7 | R71: of:=[.Q71]+1 -> 8 | S71: of:=[.$B$6] + (([.R71]-1) * [.$B$7]) -> 180 | T71: of:=([.R71]/2)*([.$B$6]+[.S71]) -> 880 | U71: of:=[.T71]>=[.G71] -> true | V71: of:=[.Q71]*[.$B$9] -> 700 | W71: of:=[.F71]+[.V71] -> 17950 | X71: of:=[.W71]>=[.$B$1] -> false
E72: 70 | F72: of:=[.E72]*[.$B$3] -> 17500 | G72: of:=[.E72]*[.$B$4] -> 793.1 | J72: of:=[.$B$7] -> 20 | K72: of:=(2*[.$B$6])-[.$B$7] -> 60 | L72: of:=-2*[.T72] -> -1760 | M72: of:=((-[.K72])+SQRT(([.K72]^2) - (4*[.J72]*[.L72])))/(2*[.J72]) -> 8 | N72: of:=[.M72]-1 -> 7 | Q72: 7 | R72: of:=[.Q72]+1 -> 8 | S72: of:=[.$B$6] + (([.R72]-1) * [.$B$7]) -> 180 | T72: of:=([.R72]/2)*([.$B$6]+[.S72]) -> 880 | U72: of:=[.T72]>=[.G72] -> true | V72: of:=[.Q72]*[.$B$9] -> 700 | W72: of:=[.F72]+[.V72] -> 18200 | X72: of:=[.W72]>=[.$B$1] -> false
E73: 71 | F73: of:=[.E73]*[.$B$3] -> 17750 | G73: of:=[.E73]*[.$B$4] -> 804.43 | J73: of:=[.$B$7] -> 20 | K73: of:=(2*[.$B$6])-[.$B$7] -> 60 | L73: of:=-2*[.T73] -> -1760 | M73: of:=((-[.K73])+SQRT(([.K73]^2) - (4*[.J73]*[.L73])))/(2*[.J73]) -> 8 | N73: of:=[.M73]-1 -> 7 | Q73: 7 | R73: of:=[.Q73]+1 -> 8 | S73: of:=[.$B$6] + (([.R73]-1) * [.$B$7]) -> 180 | T73: of:=([.R73]/2)*([.$B$6]+[.S73]) -> 880 | U73: of:=[.T73]>=[.G73] -> true | V73: of:=[.Q73]*[.$B$9] -> 700 | W73: of:=[.F73]+[.V73] -> 18450 | X73: of:=[.W73]>=[.$B$1] -> false
E74: 72 | F74: of:=[.E74]*[.$B$3] -> 18000 | G74: of:=[.E74]*[.$B$4] -> 815.76 | J74: of:=[.$B$7] -> 20 | K74: of:=(2*[.$B$6])-[.$B$7] -> 60 | L74: of:=-2*[.T74] -> -1760 | M74: of:=((-[.K74])+SQRT(([.K74]^2) - (4*[.J74]*[.L74])))/(2*[.J74]) -> 8 | N74: of:=[.M74]-1 -> 7 | Q74: 7 | R74: of:=[.Q74]+1 -> 8 | S74: of:=[.$B$6] + (([.R74]-1) * [.$B$7]) -> 180 | T74: of:=([.R74]/2)*([.$B$6]+[.S74]) -> 880 | U74: of:=[.T74]>=[.G74] -> true | V74: of:=[.Q74]*[.$B$9] -> 700 | W74: of:=[.F74]+[.V74] -> 18700 | X74: of:=[.W74]>=[.$B$1] -> false
E75: 73 | F75: of:=[.E75]*[.$B$3] -> 18250 | G75: of:=[.E75]*[.$B$4] -> 827.09 | J75: of:=[.$B$7] -> 20 | K75: of:=(2*[.$B$6])-[.$B$7] -> 60 | L75: of:=-2*[.T75] -> -1760 | M75: of:=((-[.K75])+SQRT(([.K75]^2) - (4*[.J75]*[.L75])))/(2*[.J75]) -> 8 | N75: of:=[.M75]-1 -> 7 | Q75: 7 | R75: of:=[.Q75]+1 -> 8 | S75: of:=[.$B$6] + (([.R75]-1) * [.$B$7]) -> 180 | T75: of:=([.R75]/2)*([.$B$6]+[.S75]) -> 880 | U75: of:=[.T75]>=[.G75] -> true | V75: of:=[.Q75]*[.$B$9] -> 700 | W75: of:=[.F75]+[.V75] -> 18950 | X75: of:=[.W75]>=[.$B$1] -> false
E76: 74 | F76: of:=[.E76]*[.$B$3] -> 18500 | G76: of:=[.E76]*[.$B$4] -> 838.42 | J76: of:=[.$B$7] -> 20 | K76: of:=(2*[.$B$6])-[.$B$7] -> 60 | L76: of:=-2*[.T76] -> -1760 | M76: of:=((-[.K76])+SQRT(([.K76]^2) - (4*[.J76]*[.L76])))/(2*[.J76]) -> 8 | N76: of:=[.M76]-1 -> 7 | Q76: 7 | R76: of:=[.Q76]+1 -> 8 | S76: of:=[.$B$6] + (([.R76]-1) * [.$B$7]) -> 180 | T76: of:=([.R76]/2)*([.$B$6]+[.S76]) -> 880 | U76: of:=[.T76]>=[.G76] -> true | V76: of:=[.Q76]*[.$B$9] -> 700 | W76: of:=[.F76]+[.V76] -> 19200 | X76: of:=[.W76]>=[.$B$1] -> false
E77: 75 | F77: of:=[.E77]*[.$B$3] -> 18750 | G77: of:=[.E77]*[.$B$4] -> 849.75 | J77: of:=[.$B$7] -> 20 | K77: of:=(2*[.$B$6])-[.$B$7] -> 60 | L77: of:=-2*[.T77] -> -1760 | M77: of:=((-[.K77])+SQRT(([.K77]^2) - (4*[.J77]*[.L77])))/(2*[.J77]) -> 8 | N77: of:=[.M77]-1 -> 7 | Q77: 7 | R77: of:=[.Q77]+1 -> 8 | S77: of:=[.$B$6] + (([.R77]-1) * [.$B$7]) -> 180 | T77: of:=([.R77]/2)*([.$B$6]+[.S77]) -> 880 | U77: of:=[.T77]>=[.G77] -> true | V77: of:=[.Q77]*[.$B$9] -> 700 | W77: of:=[.F77]+[.V77] -> 19450 | X77: of:=[.W77]>=[.$B$1] -> false
E78: 76 | F78: of:=[.E78]*[.$B$3] -> 19000 | G78: of:=[.E78]*[.$B$4] -> 861.08 | J78: of:=[.$B$7] -> 20 | K78: of:=(2*[.$B$6])-[.$B$7] -> 60 | L78: of:=-2*[.T78] -> -1760 | M78: of:=((-[.K78])+SQRT(([.K78]^2) - (4*[.J78]*[.L78])))/(2*[.J78]) -> 8 | N78: of:=[.M78]-1 -> 7 | Q78: 7 | R78: of:=[.Q78]+1 -> 8 | S78: of:=[.$B$6] + (([.R78]-1) * [.$B$7]) -> 180 | T78: of:=([.R78]/2)*([.$B$6]+[.S78]) -> 880 | U78: of:=[.T78]>=[.G78] -> true | V78: of:=[.Q78]*[.$B$9] -> 700 | W78: of:=[.F78]+[.V78] -> 19700 | X78: of:=[.W78]>=[.$B$1] -> false
E79: 77 | F79: of:=[.E79]*[.$B$3] -> 19250 | G79: of:=[.E79]*[.$B$4] -> 872.41 | J79: of:=[.$B$7] -> 20 | K79: of:=(2*[.$B$6])-[.$B$7] -> 60 | L79: of:=-2*[.T79] -> -1760 | M79: of:=((-[.K79])+SQRT(([.K79]^2) - (4*[.J79]*[.L79])))/(2*[.J79]) -> 8 | N79: of:=[.M79]-1 -> 7 | Q79: 7 | R79: of:=[.Q79]+1 -> 8 | S79: of:=[.$B$6] + (([.R79]-1) * [.$B$7]) -> 180 | T79: of:=([.R79]/2)*([.$B$6]+[.S79]) -> 880 | U79: of:=[.T79]>=[.G79] -> true | V79: of:=[.Q79]*[.$B$9] -> 700 | W79: of:=[.F79]+[.V79] -> 19950 | X79: of:=[.W79]>=[.$B$1] -> false
E80: 78 | F80: of:=[.E80]*[.$B$3] -> 19500 | G80: of:=[.E80]*[.$B$4] -> 883.74 | J80: of:=[.$B$7] -> 20 | K80: of:=(2*[.$B$6])-[.$B$7] -> 60 | L80: of:=-2*[.T80] -> -2160 | M80: of:=((-[.K80])+SQRT(([.K80]^2) - (4*[.J80]*[.L80])))/(2*[.J80]) -> 9 | N80: of:=[.M80]-1 -> 8 | Q80: 8 | R80: of:=[.Q80]+1 -> 9 | S80: of:=[.$B$6] + (([.R80]-1) * [.$B$7]) -> 200 | T80: of:=([.R80]/2)*([.$B$6]+[.S80]) -> 1080 | U80: of:=[.T80]>=[.G80] -> true | V80: of:=[.Q80]*[.$B$9] -> 800 | W80: of:=[.F80]+[.V80] -> 20300 | X80: of:=[.W80]>=[.$B$1] -> false
E81: 79 | F81: of:=[.E81]*[.$B$3] -> 19750 | G81: of:=[.E81]*[.$B$4] -> 895.07 | J81: of:=[.$B$7] -> 20 | K81: of:=(2*[.$B$6])-[.$B$7] -> 60 | L81: of:=-2*[.T81] -> -2160 | M81: of:=((-[.K81])+SQRT(([.K81]^2) - (4*[.J81]*[.L81])))/(2*[.J81]) -> 9 | N81: of:=[.M81]-1 -> 8 | Q81: 8 | R81: of:=[.Q81]+1 -> 9 | S81: of:=[.$B$6] + (([.R81]-1) * [.$B$7]) -> 200 | T81: of:=([.R81]/2)*([.$B$6]+[.S81]) -> 1080 | U81: of:=[.T81]>=[.G81] -> true | V81: of:=[.Q81]*[.$B$9] -> 800 | W81: of:=[.F81]+[.V81] -> 20550 | X81: of:=[.W81]>=[.$B$1] -> false
E82: 80 | F82: of:=[.E82]*[.$B$3] -> 20000 | G82: of:=[.E82]*[.$B$4] -> 906.4 | J82: of:=[.$B$7] -> 20 | K82: of:=(2*[.$B$6])-[.$B$7] -> 60 | L82: of:=-2*[.T82] -> -2160 | M82: of:=((-[.K82])+SQRT(([.K82]^2) - (4*[.J82]*[.L82])))/(2*[.J82]) -> 9 | N82: of:=[.M82]-1 -> 8 | Q82: 8 | R82: of:=[.Q82]+1 -> 9 | S82: of:=[.$B$6] + (([.R82]-1) * [.$B$7]) -> 200 | T82: of:=([.R82]/2)*([.$B$6]+[.S82]) -> 1080 | U82: of:=[.T82]>=[.G82] -> true | V82: of:=[.Q82]*[.$B$9] -> 800 | W82: of:=[.F82]+[.V82] -> 20800 | X82: of:=[.W82]>=[.$B$1] -> false
E83: 81 | F83: of:=[.E83]*[.$B$3] -> 20250 | G83: of:=[.E83]*[.$B$4] -> 917.73 | J83: of:=[.$B$7] -> 20 | K83: of:=(2*[.$B$6])-[.$B$7] -> 60 | L83: of:=-2*[.T83] -> -2160 | M83: of:=((-[.K83])+SQRT(([.K83]^2) - (4*[.J83]*[.L83])))/(2*[.J83]) -> 9 | N83: of:=[.M83]-1 -> 8 | Q83: 8 | R83: of:=[.Q83]+1 -> 9 | S83: of:=[.$B$6] + (([.R83]-1) * [.$B$7]) -> 200 | T83: of:=([.R83]/2)*([.$B$6]+[.S83]) -> 1080 | U83: of:=[.T83]>=[.G83] -> true | V83: of:=[.Q83]*[.$B$9] -> 800 | W83: of:=[.F83]+[.V83] -> 21050 | X83: of:=[.W83]>=[.$B$1] -> false
E84: 82 | F84: of:=[.E84]*[.$B$3] -> 20500 | G84: of:=[.E84]*[.$B$4] -> 929.06 | J84: of:=[.$B$7] -> 20 | K84: of:=(2*[.$B$6])-[.$B$7] -> 60 | L84: of:=-2*[.T84] -> -2160 | M84: of:=((-[.K84])+SQRT(([.K84]^2) - (4*[.J84]*[.L84])))/(2*[.J84]) -> 9 | N84: of:=[.M84]-1 -> 8 | Q84: 8 | R84: of:=[.Q84]+1 -> 9 | S84: of:=[.$B$6] + (([.R84]-1) * [.$B$7]) -> 200 | T84: of:=([.R84]/2)*([.$B$6]+[.S84]) -> 1080 | U84: of:=[.T84]>=[.G84] -> true | V84: of:=[.Q84]*[.$B$9] -> 800 | W84: of:=[.F84]+[.V84] -> 21300 | X84: of:=[.W84]>=[.$B$1] -> false
E85: 83 | F85: of:=[.E85]*[.$B$3] -> 20750 | G85: of:=[.E85]*[.$B$4] -> 940.39 | J85: of:=[.$B$7] -> 20 | K85: of:=(2*[.$B$6])-[.$B$7] -> 60 | L85: of:=-2*[.T85] -> -2160 | M85: of:=((-[.K85])+SQRT(([.K85]^2) - (4*[.J85]*[.L85])))/(2*[.J85]) -> 9 | N85: of:=[.M85]-1 -> 8 | Q85: 8 | R85: of:=[.Q85]+1 -> 9 | S85: of:=[.$B$6] + (([.R85]-1) * [.$B$7]) -> 200 | T85: of:=([.R85]/2)*([.$B$6]+[.S85]) -> 1080 | U85: of:=[.T85]>=[.G85] -> true | V85: of:=[.Q85]*[.$B$9] -> 800 | W85: of:=[.F85]+[.V85] -> 21550 | X85: of:=[.W85]>=[.$B$1] -> false
E86: 84 | F86: of:=[.E86]*[.$B$3] -> 21000 | G86: of:=[.E86]*[.$B$4] -> 951.72 | J86: of:=[.$B$7] -> 20 | K86: of:=(2*[.$B$6])-[.$B$7] -> 60 | L86: of:=-2*[.T86] -> -2160 | M86: of:=((-[.K86])+SQRT(([.K86]^2) - (4*[.J86]*[.L86])))/(2*[.J86]) -> 9 | N86: of:=[.M86]-1 -> 8 | Q86: 8 | R86: of:=[.Q86]+1 -> 9 | S86: of:=[.$B$6] + (([.R86]-1) * [.$B$7]) -> 200 | T86: of:=([.R86]/2)*([.$B$6]+[.S86]) -> 1080 | U86: of:=[.T86]>=[.G86] -> true | V86: of:=[.Q86]*[.$B$9] -> 800 | W86: of:=[.F86]+[.V86] -> 21800 | X86: of:=[.W86]>=[.$B$1] -> false
E87: 85 | F87: of:=[.E87]*[.$B$3] -> 21250 | G87: of:=[.E87]*[.$B$4] -> 963.05 | J87: of:=[.$B$7] -> 20 | K87: of:=(2*[.$B$6])-[.$B$7] -> 60 | L87: of:=-2*[.T87] -> -2160 | M87: of:=((-[.K87])+SQRT(([.K87]^2) - (4*[.J87]*[.L87])))/(2*[.J87]) -> 9 | N87: of:=[.M87]-1 -> 8 | Q87: 8 | R87: of:=[.Q87]+1 -> 9 | S87: of:=[.$B$6] + (([.R87]-1) * [.$B$7]) -> 200 | T87: of:=([.R87]/2)*([.$B$6]+[.S87]) -> 1080 | U87: of:=[.T87]>=[.G87] -> true | V87: of:=[.Q87]*[.$B$9] -> 800 | W87: of:=[.F87]+[.V87] -> 22050 | X87: of:=[.W87]>=[.$B$1] -> false
E88: 86 | F88: of:=[.E88]*[.$B$3] -> 21500 | G88: of:=[.E88]*[.$B$4] -> 974.38 | J88: of:=[.$B$7] -> 20 | K88: of:=(2*[.$B$6])-[.$B$7] -> 60 | L88: of:=-2*[.T88] -> -2160 | M88: of:=((-[.K88])+SQRT(([.K88]^2) - (4*[.J88]*[.L88])))/(2*[.J88]) -> 9 | N88: of:=[.M88]-1 -> 8 | Q88: 8 | R88: of:=[.Q88]+1 -> 9 | S88: of:=[.$B$6] + (([.R88]-1) * [.$B$7]) -> 200 | T88: of:=([.R88]/2)*([.$B$6]+[.S88]) -> 1080 | U88: of:=[.T88]>=[.G88] -> true | V88: of:=[.Q88]*[.$B$9] -> 800 | W88: of:=[.F88]+[.V88] -> 22300 | X88: of:=[.W88]>=[.$B$1] -> false
E89: 87 | F89: of:=[.E89]*[.$B$3] -> 21750 | G89: of:=[.E89]*[.$B$4] -> 985.71 | J89: of:=[.$B$7] -> 20 | K89: of:=(2*[.$B$6])-[.$B$7] -> 60 | L89: of:=-2*[.T89] -> -2160 | M89: of:=((-[.K89])+SQRT(([.K89]^2) - (4*[.J89]*[.L89])))/(2*[.J89]) -> 9 | N89: of:=[.M89]-1 -> 8 | Q89: 8 | R89: of:=[.Q89]+1 -> 9 | S89: of:=[.$B$6] + (([.R89]-1) * [.$B$7]) -> 200 | T89: of:=([.R89]/2)*([.$B$6]+[.S89]) -> 1080 | U89: of:=[.T89]>=[.G89] -> true | V89: of:=[.Q89]*[.$B$9] -> 800 | W89: of:=[.F89]+[.V89] -> 22550 | X89: of:=[.W89]>=[.$B$1] -> false
E90: 88 | F90: of:=[.E90]*[.$B$3] -> 22000 | G90: of:=[.E90]*[.$B$4] -> 997.04 | J90: of:=[.$B$7] -> 20 | K90: of:=(2*[.$B$6])-[.$B$7] -> 60 | L90: of:=-2*[.T90] -> -2160 | M90: of:=((-[.K90])+SQRT(([.K90]^2) - (4*[.J90]*[.L90])))/(2*[.J90]) -> 9 | N90: of:=[.M90]-1 -> 8 | Q90: 8 | R90: of:=[.Q90]+1 -> 9 | S90: of:=[.$B$6] + (([.R90]-1) * [.$B$7]) -> 200 | T90: of:=([.R90]/2)*([.$B$6]+[.S90]) -> 1080 | U90: of:=[.T90]>=[.G90] -> true | V90: of:=[.Q90]*[.$B$9] -> 800 | W90: of:=[.F90]+[.V90] -> 22800 | X90: of:=[.W90]>=[.$B$1] -> false
E91: 89 | F91: of:=[.E91]*[.$B$3] -> 22250 | G91: of:=[.E91]*[.$B$4] -> 1008.37 | J91: of:=[.$B$7] -> 20 | K91: of:=(2*[.$B$6])-[.$B$7] -> 60 | L91: of:=-2*[.T91] -> -2160 | M91: of:=((-[.K91])+SQRT(([.K91]^2) - (4*[.J91]*[.L91])))/(2*[.J91]) -> 9 | N91: of:=[.M91]-1 -> 8 | Q91: 8 | R91: of:=[.Q91]+1 -> 9 | S91: of:=[.$B$6] + (([.R91]-1) * [.$B$7]) -> 200 | T91: of:=([.R91]/2)*([.$B$6]+[.S91]) -> 1080 | U91: of:=[.T91]>=[.G91] -> true | V91: of:=[.Q91]*[.$B$9] -> 800 | W91: of:=[.F91]+[.V91] -> 23050 | X91: of:=[.W91]>=[.$B$1] -> false
E92: 90 | F92: of:=[.E92]*[.$B$3] -> 22500 | G92: of:=[.E92]*[.$B$4] -> 1019.7 | J92: of:=[.$B$7] -> 20 | K92: of:=(2*[.$B$6])-[.$B$7] -> 60 | L92: of:=-2*[.T92] -> -2160 | M92: of:=((-[.K92])+SQRT(([.K92]^2) - (4*[.J92]*[.L92])))/(2*[.J92]) -> 9 | N92: of:=[.M92]-1 -> 8 | Q92: 8 | R92: of:=[.Q92]+1 -> 9 | S92: of:=[.$B$6] + (([.R92]-1) * [.$B$7]) -> 200 | T92: of:=([.R92]/2)*([.$B$6]+[.S92]) -> 1080 | U92: of:=[.T92]>=[.G92] -> true | V92: of:=[.Q92]*[.$B$9] -> 800 | W92: of:=[.F92]+[.V92] -> 23300 | X92: of:=[.W92]>=[.$B$1] -> false
E93: 91 | F93: of:=[.E93]*[.$B$3] -> 22750 | G93: of:=[.E93]*[.$B$4] -> 1031.03 | J93: of:=[.$B$7] -> 20 | K93: of:=(2*[.$B$6])-[.$B$7] -> 60 | L93: of:=-2*[.T93] -> -2160 | M93: of:=((-[.K93])+SQRT(([.K93]^2) - (4*[.J93]*[.L93])))/(2*[.J93]) -> 9 | N93: of:=[.M93]-1 -> 8 | Q93: 8 | R93: of:=[.Q93]+1 -> 9 | S93: of:=[.$B$6] + (([.R93]-1) * [.$B$7]) -> 200 | T93: of:=([.R93]/2)*([.$B$6]+[.S93]) -> 1080 | U93: of:=[.T93]>=[.G93] -> true | V93: of:=[.Q93]*[.$B$9] -> 800 | W93: of:=[.F93]+[.V93] -> 23550 | X93: of:=[.W93]>=[.$B$1] -> false
E94: 92 | F94: of:=[.E94]*[.$B$3] -> 23000 | G94: of:=[.E94]*[.$B$4] -> 1042.36 | J94: of:=[.$B$7] -> 20 | K94: of:=(2*[.$B$6])-[.$B$7] -> 60 | L94: of:=-2*[.T94] -> -2160 | M94: of:=((-[.K94])+SQRT(([.K94]^2) - (4*[.J94]*[.L94])))/(2*[.J94]) -> 9 | N94: of:=[.M94]-1 -> 8 | Q94: 8 | R94: of:=[.Q94]+1 -> 9 | S94: of:=[.$B$6] + (([.R94]-1) * [.$B$7]) -> 200 | T94: of:=([.R94]/2)*([.$B$6]+[.S94]) -> 1080 | U94: of:=[.T94]>=[.G94] -> true | V94: of:=[.Q94]*[.$B$9] -> 800 | W94: of:=[.F94]+[.V94] -> 23800 | X94: of:=[.W94]>=[.$B$1] -> false
E95: 93 | F95: of:=[.E95]*[.$B$3] -> 23250 | G95: of:=[.E95]*[.$B$4] -> 1053.69 | J95: of:=[.$B$7] -> 20 | K95: of:=(2*[.$B$6])-[.$B$7] -> 60 | L95: of:=-2*[.T95] -> -2160 | M95: of:=((-[.K95])+SQRT(([.K95]^2) - (4*[.J95]*[.L95])))/(2*[.J95]) -> 9 | N95: of:=[.M95]-1 -> 8 | Q95: 8 | R95: of:=[.Q95]+1 -> 9 | S95: of:=[.$B$6] + (([.R95]-1) * [.$B$7]) -> 200 | T95: of:=([.R95]/2)*([.$B$6]+[.S95]) -> 1080 | U95: of:=[.T95]>=[.G95] -> true | V95: of:=[.Q95]*[.$B$9] -> 800 | W95: of:=[.F95]+[.V95] -> 24050 | X95: of:=[.W95]>=[.$B$1] -> false
E96: 94 | F96: of:=[.E96]*[.$B$3] -> 23500 | G96: of:=[.E96]*[.$B$4] -> 1065.02 | J96: of:=[.$B$7] -> 20 | K96: of:=(2*[.$B$6])-[.$B$7] -> 60 | L96: of:=-2*[.T96] -> -2160 | M96: of:=((-[.K96])+SQRT(([.K96]^2) - (4*[.J96]*[.L96])))/(2*[.J96]) -> 9 | N96: of:=[.M96]-1 -> 8 | Q96: 8 | R96: of:=[.Q96]+1 -> 9 | S96: of:=[.$B$6] + (([.R96]-1) * [.$B$7]) -> 200 | T96: of:=([.R96]/2)*([.$B$6]+[.S96]) -> 1080 | U96: of:=[.T96]>=[.G96] -> true | V96: of:=[.Q96]*[.$B$9] -> 800 | W96: of:=[.F96]+[.V96] -> 24300 | X96: of:=[.W96]>=[.$B$1] -> false
E97: 95 | F97: of:=[.E97]*[.$B$3] -> 23750 | G97: of:=[.E97]*[.$B$4] -> 1076.35 | J97: of:=[.$B$7] -> 20 | K97: of:=(2*[.$B$6])-[.$B$7] -> 60 | L97: of:=-2*[.T97] -> -2160 | M97: of:=((-[.K97])+SQRT(([.K97]^2) - (4*[.J97]*[.L97])))/(2*[.J97]) -> 9 | N97: of:=[.M97]-1 -> 8 | Q97: 8 | R97: of:=[.Q97]+1 -> 9 | S97: of:=[.$B$6] + (([.R97]-1) * [.$B$7]) -> 200 | T97: of:=([.R97]/2)*([.$B$6]+[.S97]) -> 1080 | U97: of:=[.T97]>=[.G97] -> true | V97: of:=[.Q97]*[.$B$9] -> 800 | W97: of:=[.F97]+[.V97] -> 24550 | X97: of:=[.W97]>=[.$B$1] -> false
E98: 96 | F98: of:=[.E98]*[.$B$3] -> 24000 | G98: of:=[.E98]*[.$B$4] -> 1087.68 | J98: of:=[.$B$7] -> 20 | K98: of:=(2*[.$B$6])-[.$B$7] -> 60 | L98: of:=-2*[.T98] -> -2600 | M98: of:=((-[.K98])+SQRT(([.K98]^2) - (4*[.J98]*[.L98])))/(2*[.J98]) -> 10 | N98: of:=[.M98]-1 -> 9 | Q98: 9 | R98: of:=[.Q98]+1 -> 10 | S98: of:=[.$B$6] + (([.R98]-1) * [.$B$7]) -> 220 | T98: of:=([.R98]/2)*([.$B$6]+[.S98]) -> 1300 | U98: of:=[.T98]>=[.G98] -> true | V98: of:=[.Q98]*[.$B$9] -> 900 | W98: of:=[.F98]+[.V98] -> 24900 | X98: of:=[.W98]>=[.$B$1] -> false
E99: 97 | F99: of:=[.E99]*[.$B$3] -> 24250 | G99: of:=[.E99]*[.$B$4] -> 1099.01 | J99: of:=[.$B$7] -> 20 | K99: of:=(2*[.$B$6])-[.$B$7] -> 60 | L99: of:=-2*[.T99] -> -2600 | M99: of:=((-[.K99])+SQRT(([.K99]^2) - (4*[.J99]*[.L99])))/(2*[.J99]) -> 10 | N99: of:=[.M99]-1 -> 9 | Q99: 9 | R99: of:=[.Q99]+1 -> 10 | S99: of:=[.$B$6] + (([.R99]-1) * [.$B$7]) -> 220 | T99: of:=([.R99]/2)*([.$B$6]+[.S99]) -> 1300 | U99: of:=[.T99]>=[.G99] -> true | V99: of:=[.Q99]*[.$B$9] -> 900 | W99: of:=[.F99]+[.V99] -> 25150 | X99: of:=[.W99]>=[.$B$1] -> false
E100: 98 | F100: of:=[.E100]*[.$B$3] -> 24500 | G100: of:=[.E100]*[.$B$4] -> 1110.34 | J100: of:=[.$B$7] -> 20 | K100: of:=(2*[.$B$6])-[.$B$7] -> 60 | L100: of:=-2*[.T100] -> -2600 | M100: of:=((-[.K100])+SQRT(([.K100]^2) - (4*[.J100]*[.L100])))/(2*[.J100]) -> 10 | N100: of:=[.M100]-1 -> 9 | Q100: 9 | R100: of:=[.Q100]+1 -> 10 | S100: of:=[.$B$6] + (([.R100]-1) * [.$B$7]) -> 220 | T100: of:=([.R100]/2)*([.$B$6]+[.S100]) -> 1300 | U100: of:=[.T100]>=[.G100] -> true | V100: of:=[.Q100]*[.$B$9] -> 900 | W100: of:=[.F100]+[.V100] -> 25400 | X100: of:=[.W100]>=[.$B$1] -> false
E101: 99 | F101: of:=[.E101]*[.$B$3] -> 24750 | G101: of:=[.E101]*[.$B$4] -> 1121.67 | J101: of:=[.$B$7] -> 20 | K101: of:=(2*[.$B$6])-[.$B$7] -> 60 | L101: of:=-2*[.T101] -> -2600 | M101: of:=((-[.K101])+SQRT(([.K101]^2) - (4*[.J101]*[.L101])))/(2*[.J101]) -> 10 | N101: of:=[.M101]-1 -> 9 | Q101: 9 | R101: of:=[.Q101]+1 -> 10 | S101: of:=[.$B$6] + (([.R101]-1) * [.$B$7]) -> 220 | T101: of:=([.R101]/2)*([.$B$6]+[.S101]) -> 1300 | U101: of:=[.T101]>=[.G101] -> true | V101: of:=[.Q101]*[.$B$9] -> 900 | W101: of:=[.F101]+[.V101] -> 25650 | X101: of:=[.W101]>=[.$B$1] -> true
E102: 100 | F102: of:=[.E102]*[.$B$3] -> 25000 | G102: of:=[.E102]*[.$B$4] -> 1133 | J102: of:=[.$B$7] -> 20 | K102: of:=(2*[.$B$6])-[.$B$7] -> 60 | L102: of:=-2*[.T102] -> -2600 | M102: of:=((-[.K102])+SQRT(([.K102]^2) - (4*[.J102]*[.L102])))/(2*[.J102]) -> 10 | N102: of:=[.M102]-1 -> 9 | Q102: 9 | R102: of:=[.Q102]+1 -> 10 | S102: of:=[.$B$6] + (([.R102]-1) * [.$B$7]) -> 220 | T102: of:=([.R102]/2)*([.$B$6]+[.S102]) -> 1300 | U102: of:=[.T102]>=[.G102] -> true | V102: of:=[.Q102]*[.$B$9] -> 900 | W102: of:=[.F102]+[.V102] -> 25900 | X102: of:=[.W102]>=[.$B$1] -> true
E103: 101 | F103: of:=[.E103]*[.$B$3] -> 25250 | G103: of:=[.E103]*[.$B$4] -> 1144.33 | J103: of:=[.$B$7] -> 20 | K103: of:=(2*[.$B$6])-[.$B$7] -> 60 | L103: of:=-2*[.T103] -> -2600 | M103: of:=((-[.K103])+SQRT(([.K103]^2) - (4*[.J103]*[.L103])))/(2*[.J103]) -> 10 | N103: of:=[.M103]-1 -> 9 | Q103: 9 | R103: of:=[.Q103]+1 -> 10 | S103: of:=[.$B$6] + (([.R103]-1) * [.$B$7]) -> 220 | T103: of:=([.R103]/2)*([.$B$6]+[.S103]) -> 1300 | U103: of:=[.T103]>=[.G103] -> true | V103: of:=[.Q103]*[.$B$9] -> 900 | W103: of:=[.F103]+[.V103] -> 26150 | X103: of:=[.W103]>=[.$B$1] -> true
E104: 102 | F104: of:=[.E104]*[.$B$3] -> 25500 | G104: of:=[.E104]*[.$B$4] -> 1155.66 | J104: of:=[.$B$7] -> 20 | K104: of:=(2*[.$B$6])-[.$B$7] -> 60 | L104: of:=-2*[.T104] -> -2600 | M104: of:=((-[.K104])+SQRT(([.K104]^2) - (4*[.J104]*[.L104])))/(2*[.J104]) -> 10 | N104: of:=[.M104]-1 -> 9 | Q104: 9 | R104: of:=[.Q104]+1 -> 10 | S104: of:=[.$B$6] + (([.R104]-1) * [.$B$7]) -> 220 | T104: of:=([.R104]/2)*([.$B$6]+[.S104]) -> 1300 | U104: of:=[.T104]>=[.G104] -> true | V104: of:=[.Q104]*[.$B$9] -> 900 | W104: of:=[.F104]+[.V104] -> 26400 | X104: of:=[.W104]>=[.$B$1] -> true
E105: 103 | F105: of:=[.E105]*[.$B$3] -> 25750 | G105: of:=[.E105]*[.$B$4] -> 1166.99 | J105: of:=[.$B$7] -> 20 | K105: of:=(2*[.$B$6])-[.$B$7] -> 60 | L105: of:=-2*[.T105] -> -2600 | M105: of:=((-[.K105])+SQRT(([.K105]^2) - (4*[.J105]*[.L105])))/(2*[.J105]) -> 10 | N105: of:=[.M105]-1 -> 9 | Q105: 9 | R105: of:=[.Q105]+1 -> 10 | S105: of:=[.$B$6] + (([.R105]-1) * [.$B$7]) -> 220 | T105: of:=([.R105]/2)*([.$B$6]+[.S105]) -> 1300 | U105: of:=[.T105]>=[.G105] -> true | V105: of:=[.Q105]*[.$B$9] -> 900 | W105: of:=[.F105]+[.V105] -> 26650 | X105: of:=[.W105]>=[.$B$1] -> true
E106: 104 | F106: of:=[.E106]*[.$B$3] -> 26000 | G106: of:=[.E106]*[.$B$4] -> 1178.32 | J106: of:=[.$B$7] -> 20 | K106: of:=(2*[.$B$6])-[.$B$7] -> 60 | L106: of:=-2*[.T106] -> -2600 | M106: of:=((-[.K106])+SQRT(([.K106]^2) - (4*[.J106]*[.L106])))/(2*[.J106]) -> 10 | N106: of:=[.M106]-1 -> 9 | Q106: 9 | R106: of:=[.Q106]+1 -> 10 | S106: of:=[.$B$6] + (([.R106]-1) * [.$B$7]) -> 220 | T106: of:=([.R106]/2)*([.$B$6]+[.S106]) -> 1300 | U106: of:=[.T106]>=[.G106] -> true | V106: of:=[.Q106]*[.$B$9] -> 900 | W106: of:=[.F106]+[.V106] -> 26900 | X106: of:=[.W106]>=[.$B$1] -> true
E107: 105 | F107: of:=[.E107]*[.$B$3] -> 26250 | G107: of:=[.E107]*[.$B$4] -> 1189.65 | J107: of:=[.$B$7] -> 20 | K107: of:=(2*[.$B$6])-[.$B$7] -> 60 | L107: of:=-2*[.T107] -> -2600 | M107: of:=((-[.K107])+SQRT(([.K107]^2) - (4*[.J107]*[.L107])))/(2*[.J107]) -> 10 | N107: of:=[.M107]-1 -> 9 | Q107: 9 | R107: of:=[.Q107]+1 -> 10 | S107: of:=[.$B$6] + (([.R107]-1) * [.$B$7]) -> 220 | T107: of:=([.R107]/2)*([.$B$6]+[.S107]) -> 1300 | U107: of:=[.T107]>=[.G107] -> true | V107: of:=[.Q107]*[.$B$9] -> 900 | W107: of:=[.F107]+[.V107] -> 27150 | X107: of:=[.W107]>=[.$B$1] -> true
E108: 106 | F108: of:=[.E108]*[.$B$3] -> 26500 | G108: of:=[.E108]*[.$B$4] -> 1200.98 | J108: of:=[.$B$7] -> 20 | K108: of:=(2*[.$B$6])-[.$B$7] -> 60 | L108: of:=-2*[.T108] -> -2600 | M108: of:=((-[.K108])+SQRT(([.K108]^2) - (4*[.J108]*[.L108])))/(2*[.J108]) -> 10 | N108: of:=[.M108]-1 -> 9 | Q108: 9 | R108: of:=[.Q108]+1 -> 10 | S108: of:=[.$B$6] + (([.R108]-1) * [.$B$7]) -> 220 | T108: of:=([.R108]/2)*([.$B$6]+[.S108]) -> 1300 | U108: of:=[.T108]>=[.G108] -> true | V108: of:=[.Q108]*[.$B$9] -> 900 | W108: of:=[.F108]+[.V108] -> 27400 | X108: of:=[.W108]>=[.$B$1] -> true
E109: 107 | F109: of:=[.E109]*[.$B$3] -> 26750 | G109: of:=[.E109]*[.$B$4] -> 1212.31 | J109: of:=[.$B$7] -> 20 | K109: of:=(2*[.$B$6])-[.$B$7] -> 60 | L109: of:=-2*[.T109] -> -2600 | M109: of:=((-[.K109])+SQRT(([.K109]^2) - (4*[.J109]*[.L109])))/(2*[.J109]) -> 10 | N109: of:=[.M109]-1 -> 9 | Q109: 9 | R109: of:=[.Q109]+1 -> 10 | S109: of:=[.$B$6] + (([.R109]-1) * [.$B$7]) -> 220 | T109: of:=([.R109]/2)*([.$B$6]+[.S109]) -> 1300 | U109: of:=[.T109]>=[.G109] -> true | V109: of:=[.Q109]*[.$B$9] -> 900 | W109: of:=[.F109]+[.V109] -> 27650 | X109: of:=[.W109]>=[.$B$1] -> true
E110: 108 | F110: of:=[.E110]*[.$B$3] -> 27000 | G110: of:=[.E110]*[.$B$4] -> 1223.64 | J110: of:=[.$B$7] -> 20 | K110: of:=(2*[.$B$6])-[.$B$7] -> 60 | L110: of:=-2*[.T110] -> -2600 | M110: of:=((-[.K110])+SQRT(([.K110]^2) - (4*[.J110]*[.L110])))/(2*[.J110]) -> 10 | N110: of:=[.M110]-1 -> 9 | Q110: 9 | R110: of:=[.Q110]+1 -> 10 | S110: of:=[.$B$6] + (([.R110]-1) * [.$B$7]) -> 220 | T110: of:=([.R110]/2)*([.$B$6]+[.S110]) -> 1300 | U110: of:=[.T110]>=[.G110] -> true | V110: of:=[.Q110]*[.$B$9] -> 900 | W110: of:=[.F110]+[.V110] -> 27900 | X110: of:=[.W110]>=[.$B$1] -> true
E111: 109 | F111: of:=[.E111]*[.$B$3] -> 27250 | G111: of:=[.E111]*[.$B$4] -> 1234.97 | J111: of:=[.$B$7] -> 20 | K111: of:=(2*[.$B$6])-[.$B$7] -> 60 | L111: of:=-2*[.T111] -> -2600 | M111: of:=((-[.K111])+SQRT(([.K111]^2) - (4*[.J111]*[.L111])))/(2*[.J111]) -> 10 | N111: of:=[.M111]-1 -> 9 | Q111: 9 | R111: of:=[.Q111]+1 -> 10 | S111: of:=[.$B$6] + (([.R111]-1) * [.$B$7]) -> 220 | T111: of:=([.R111]/2)*([.$B$6]+[.S111]) -> 1300 | U111: of:=[.T111]>=[.G111] -> true | V111: of:=[.Q111]*[.$B$9] -> 900 | W111: of:=[.F111]+[.V111] -> 28150 | X111: of:=[.W111]>=[.$B$1] -> true
E112: 110 | F112: of:=[.E112]*[.$B$3] -> 27500 | G112: of:=[.E112]*[.$B$4] -> 1246.3 | J112: of:=[.$B$7] -> 20 | K112: of:=(2*[.$B$6])-[.$B$7] -> 60 | L112: of:=-2*[.T112] -> -2600 | M112: of:=((-[.K112])+SQRT(([.K112]^2) - (4*[.J112]*[.L112])))/(2*[.J112]) -> 10 | N112: of:=[.M112]-1 -> 9 | Q112: 9 | R112: of:=[.Q112]+1 -> 10 | S112: of:=[.$B$6] + (([.R112]-1) * [.$B$7]) -> 220 | T112: of:=([.R112]/2)*([.$B$6]+[.S112]) -> 1300 | U112: of:=[.T112]>=[.G112] -> true | V112: of:=[.Q112]*[.$B$9] -> 900 | W112: of:=[.F112]+[.V112] -> 28400 | X112: of:=[.W112]>=[.$B$1] -> true
E113: 111 | F113: of:=[.E113]*[.$B$3] -> 27750 | G113: of:=[.E113]*[.$B$4] -> 1257.63 | J113: of:=[.$B$7] -> 20 | K113: of:=(2*[.$B$6])-[.$B$7] -> 60 | L113: of:=-2*[.T113] -> -2600 | M113: of:=((-[.K113])+SQRT(([.K113]^2) - (4*[.J113]*[.L113])))/(2*[.J113]) -> 10 | N113: of:=[.M113]-1 -> 9 | Q113: 9 | R113: of:=[.Q113]+1 -> 10 | S113: of:=[.$B$6] + (([.R113]-1) * [.$B$7]) -> 220 | T113: of:=([.R113]/2)*([.$B$6]+[.S113]) -> 1300 | U113: of:=[.T113]>=[.G113] -> true | V113: of:=[.Q113]*[.$B$9] -> 900 | W113: of:=[.F113]+[.V113] -> 28650 | X113: of:=[.W113]>=[.$B$1] -> true
E114: 112 | F114: of:=[.E114]*[.$B$3] -> 28000 | G114: of:=[.E114]*[.$B$4] -> 1268.96 | J114: of:=[.$B$7] -> 20 | K114: of:=(2*[.$B$6])-[.$B$7] -> 60 | L114: of:=-2*[.T114] -> -2600 | M114: of:=((-[.K114])+SQRT(([.K114]^2) - (4*[.J114]*[.L114])))/(2*[.J114]) -> 10 | N114: of:=[.M114]-1 -> 9 | Q114: 9 | R114: of:=[.Q114]+1 -> 10 | S114: of:=[.$B$6] + (([.R114]-1) * [.$B$7]) -> 220 | T114: of:=([.R114]/2)*([.$B$6]+[.S114]) -> 1300 | U114: of:=[.T114]>=[.G114] -> true | V114: of:=[.Q114]*[.$B$9] -> 900 | W114: of:=[.F114]+[.V114] -> 28900 | X114: of:=[.W114]>=[.$B$1] -> true